uniprot_id,protein_name,gene_name,organism,function,subcellular_location,disease_association,data_source,integration_date
Q9BXS0,Collagen alpha-1(XXV) chain (Alzheimer disease amyloid-associated protein) (AMY) (CLAC-P) [Cleaved into: Collagen-like Alzheimer amyloid plaque component (CLAC)],COL25A1,Homo sapiens (Human),"FUNCTION: Inhibits fibrillization of amyloid-beta peptide during the elongation phase. Has also been shown to assemble amyloid fibrils into protease-resistant aggregates. Binds heparin. {ECO:0000269|PubMed:15522881, ECO:0000269|PubMed:15615705, ECO:0000269|PubMed:15853808, ECO:0000269|PubMed:16300410}.","SUBCELLULAR LOCATION: Membrane {ECO:0000305}; Single-pass type II membrane protein {ECO:0000305}. Note=After proteolytic cleavage, CLAC is secreted.","DISEASE: Fibrosis of extraocular muscles, congenital, 5 (CFEOM5) [MIM:616219]: An ocular motility disorder characterized by congenital dysinnervation of various cranial nerves to ocular muscles. Clinical features are ophthalmoplegia, anchoring of the eyes in downward gaze, ptosis, and backward tilt of the head. {ECO:0000269|PubMed:25500261}. Note=The disease is caused by variants affecting the gene represented in this entry.",UniProt,2026-01-05T01:02:46.025118
P05067,Amyloid-beta precursor protein (APP) (ABPP) (APPI) (Alzheimer disease amyloid A4 protein homolog) (Alzheimer disease amyloid protein) (Amyloid precursor protein) (Amyloid-beta (A4) precursor protein) (Amyloid-beta A4 protein) (Cerebral vascular amyloid peptide) (CVAP) (PreA4) (Protease nexin-II) (PN-II) [Cleaved into: N-APP; Soluble APP-alpha (S-APP-alpha); Soluble APP-beta (S-APP-beta); C99 (Beta-secretase C-terminal fragment) (Beta-CTF); Amyloid-beta protein 42 (Abeta42) (Beta-APP42); Amyloid-beta protein 40 (Abeta40) (Beta-APP40); C83 (Alpha-secretase C-terminal fragment) (Alpha-CTF); P3(42); P3(40); C80; Gamma-secretase C-terminal fragment 59 (Amyloid intracellular domain 59) (AICD-59) (AID(59)) (Gamma-CTF(59)); Gamma-secretase C-terminal fragment 57 (Amyloid intracellular domain 57) (AICD-57) (AID(57)) (Gamma-CTF(57)); Gamma-secretase C-terminal fragment 50 (Amyloid intracellular domain 50) (AICD-50) (AID(50)) (Gamma-CTF(50)); C31],APP A4 AD1,Homo sapiens (Human),"FUNCTION: Functions as a cell surface receptor and performs physiological functions on the surface of neurons relevant to neurite growth, neuronal adhesion and axonogenesis. Interaction between APP molecules on neighboring cells promotes synaptogenesis (PubMed:25122912). Involved in cell mobility and transcription regulation through protein-protein interactions. Can promote transcription activation through binding to APBB1-KAT5 and inhibits Notch signaling through interaction with Numb. Couples to apoptosis-inducing pathways such as those mediated by G(o) and JIP. Inhibits G(o) alpha ATPase activity (By similarity). Acts as a kinesin I membrane receptor, mediating the axonal transport of beta-secretase and presenilin 1 (By similarity). By acting as a kinesin I membrane receptor, plays a role in axonal anterograde transport of cargo towards synapses in axons (PubMed:17062754, PubMed:23011729). Involved in copper homeostasis/oxidative stress through copper ion reduction. In vitro, copper-metallated APP induces neuronal death directly or is potentiated through Cu(2+)-mediated low-density lipoprotein oxidation. Can regulate neurite outgrowth through binding to components of the extracellular matrix such as heparin and collagen I and IV. The splice isoforms that contain the BPTI domain possess protease inhibitor activity. Induces a AGER-dependent pathway that involves activation of p38 MAPK, resulting in internalization of amyloid-beta peptide and leading to mitochondrial dysfunction in cultured cortical neurons. Provides Cu(2+) ions for GPC1 which are required for release of nitric oxide (NO) and subsequent degradation of the heparan sulfate chains on GPC1. {ECO:0000250, ECO:0000250|UniProtKB:P12023, ECO:0000269|PubMed:17062754, ECO:0000269|PubMed:23011729, ECO:0000269|PubMed:25122912}.; FUNCTION: Amyloid-beta peptides are lipophilic metal chelators with metal-reducing activity. Bind transient metals such as copper, zinc and iron. In vitro, can reduce Cu(2+) and Fe(3+) to Cu(+) and Fe(2+), respectively. Amyloid-beta peptides bind to lipoproteins and apolipoproteins E and J in the CSF and to HDL particles in plasma, inhibiting metal-catalyzed oxidation of lipoproteins. Promotes both tau aggregation and TPK II-mediated phosphorylation. Interaction with overexpressed HADH2 leads to oxidative stress and neurotoxicity. Also binds GPC1 in lipid rafts.; FUNCTION: [Amyloid-beta protein 42]: More effective reductant than amyloid-beta protein 40. May activate mononuclear phagocytes in the brain and elicit inflammatory responses.; FUNCTION: Appicans elicit adhesion of neural cells to the extracellular matrix and may regulate neurite outgrowth in the brain. {ECO:0000250}.; FUNCTION: The gamma-CTF peptides as well as the caspase-cleaved peptides, including C31, are potent enhancers of neuronal apoptosis.","SUBCELLULAR LOCATION: Cell membrane {ECO:0000269|PubMed:10383380, ECO:0000269|PubMed:20580937, ECO:0000269|PubMed:2649245, ECO:0000305|PubMed:25122912}; Single-pass type I membrane protein {ECO:0000269|PubMed:30630874, ECO:0000305|PubMed:10383380, ECO:0000305|PubMed:25122912}. Membrane {ECO:0000269|PubMed:2900137, ECO:0000305|PubMed:22584060}; Single-pass type I membrane protein {ECO:0000269|PubMed:2900137, ECO:0000269|PubMed:30630874, ECO:0000305|PubMed:22584060}. Perikaryon {ECO:0000269|PubMed:10341243}. Cell projection, growth cone {ECO:0000269|PubMed:10341243}. Membrane, clathrin-coated pit {ECO:0000269|PubMed:20580937}. Early endosome {ECO:0000269|PubMed:20580937}. Cytoplasmic vesicle {ECO:0000269|PubMed:20580937, ECO:0000269|PubMed:25122912}. Note=Cell surface protein that rapidly becomes internalized via clathrin-coated pits. Only a minor proportion is present at the cell membrane; most of the protein is present in intracellular vesicles (PubMed:20580937). During maturation, the immature APP (N-glycosylated in the endoplasmic reticulum) moves to the Golgi complex where complete maturation occurs (O-glycosylated and sulfated). After alpha-secretase cleavage, soluble APP is released into the extracellular space and the C-terminal is internalized to endosomes and lysosomes. Some APP accumulates in secretory transport vesicles leaving the late Golgi compartment and returns to the cell surface. APP sorts to the basolateral surface in epithelial cells. During neuronal differentiation, the Thr-743 phosphorylated form is located mainly in growth cones, moderately in neurites and sparingly in the cell body (PubMed:10341243). Casein kinase phosphorylation can occur either at the cell surface or within a post-Golgi compartment. Associates with GPC1 in perinuclear compartments. Colocalizes with SORL1 in a vesicular pattern in cytoplasm and perinuclear regions. {ECO:0000269|PubMed:10341243, ECO:0000269|PubMed:20580937}.; SUBCELLULAR LOCATION: [C83]: Endoplasmic reticulum {ECO:0000269|PubMed:14527950}. Golgi apparatus {ECO:0000269|PubMed:14527950}. Early endosome {ECO:0000269|PubMed:14527950}.; SUBCELLULAR LOCATION: [C99]: Early endosome {ECO:0000269|PubMed:14527950}.; SUBCELLULAR LOCATION: [Soluble APP-beta]: Secreted {ECO:0000269|PubMed:10656250, ECO:0000269|PubMed:2649245}.; SUBCELLULAR LOCATION: [Amyloid-beta protein 40]: Cell surface {ECO:0000269|PubMed:16154999}.; SUBCELLULAR LOCATION: [Amyloid-beta protein 42]: Cell surface {ECO:0000269|PubMed:11689470, ECO:0000269|PubMed:16154999}. Note=Associates with FPR2 at the cell surface and the complex is then rapidly internalized. {ECO:0000269|PubMed:11689470}.; SUBCELLULAR LOCATION: [Gamma-secretase C-terminal fragment 59]: Nucleus {ECO:0000269|PubMed:11544248}. Cytoplasm {ECO:0000269|PubMed:11544248}. Note=Located to both the cytoplasm and nuclei of neurons. It can be translocated to the nucleus through association with APBB1 (Fe65) (PubMed:11544248). In dopaminergic neurons, the phosphorylated Thr-743 form is localized to the nucleus (By similarity). {ECO:0000250|UniProtKB:P12023, ECO:0000269|PubMed:11544248}.","DISEASE: Alzheimer disease 1 (AD1) [MIM:104300]: A form of Alzheimer disease, a neurodegenerative disorder characterized by progressive dementia, loss of cognitive abilities, and deposition of fibrillar amyloid proteins as intraneuronal neurofibrillary tangles, extracellular amyloid plaques and vascular amyloid deposits. The major constituents of these plaques are neurotoxic amyloid-beta protein 40 and amyloid-beta protein 42, that are produced by the proteolysis of the transmembrane APP protein. The cytotoxic C-terminal fragments (CTFs) and the caspase-cleaved products, such as C31, are also implicated in neuronal death. It can be associated with cerebral amyloid angiopathy. Alzheimer disease can be associated with cerebral amyloid angiopathy. {ECO:0000269|PubMed:10097173, ECO:0000269|PubMed:10631141, ECO:0000269|PubMed:10656250, ECO:0000269|PubMed:10665499, ECO:0000269|PubMed:10677483, ECO:0000269|PubMed:10867787, ECO:0000269|PubMed:11063718, ECO:0000269|PubMed:11311152, ECO:0000269|PubMed:11528419, ECO:0000269|PubMed:12034808, ECO:0000269|PubMed:1302033, ECO:0000269|PubMed:1303239, ECO:0000269|PubMed:1303275, ECO:0000269|PubMed:1415269, ECO:0000269|PubMed:1465129, ECO:0000269|PubMed:15201367, ECO:0000269|PubMed:15365148, ECO:0000269|PubMed:15668448, ECO:0000269|PubMed:1671712, ECO:0000269|PubMed:1678058, ECO:0000269|PubMed:1908231, ECO:0000269|PubMed:1925564, ECO:0000269|PubMed:1944558, ECO:0000269|PubMed:8267572, ECO:0000269|PubMed:8290042, ECO:0000269|PubMed:8476439, ECO:0000269|PubMed:8577393, ECO:0000269|PubMed:8886002, ECO:0000269|PubMed:9328472, ECO:0000269|PubMed:9754958}. Note=The disease is caused by variants affecting the gene represented in this entry.; DISEASE: Cerebral amyloid angiopathy, APP-related (CAA-APP) [MIM:605714]: A hereditary localized amyloidosis due to amyloid-beta A4 peptide(s) deposition in the cerebral vessels. The principal clinical characteristics are recurrent cerebral and cerebellar hemorrhages, recurrent strokes, cerebral ischemia, cerebral infarction, and progressive mental deterioration. Patients develop cerebral hemorrhage because of the severe cerebral amyloid angiopathy. Parenchymal amyloid deposits are rare and largely in the form of pre-amyloid lesions or diffuse plaque-like structures. They are Congo red negative and lack the dense amyloid cores commonly present in Alzheimer disease. Some affected individuals manifest progressive aphasic dementia, leukoencephalopathy, and occipital calcifications. {ECO:0000269|PubMed:11409420, ECO:0000269|PubMed:12654973, ECO:0000269|PubMed:16178030, ECO:0000269|PubMed:20697050, ECO:0000269|PubMed:2111584}. Note=The disease is caused by variants affecting the gene represented in this entry.",UniProt,2026-01-05T01:02:46.025118
P29216,Amyloid-beta precursor protein (ABPP) (APP) (Alzheimer disease amyloid A4 protein homolog) (Alzheimer disease amyloid protein) (Amyloid precursor protein) (Amyloid-beta (A4) precursor protein) (Amyloid-beta A4 protein),APP,Macaca mulatta (Rhesus macaque),"FUNCTION: Functions as a cell surface receptor and performs physiological functions on the surface of neurons relevant to neurite growth, neuronal adhesion and axonogenesis. Interaction between APP molecules on neighboring cells promotes synaptogenesis. Involved in cell mobility and transcription regulation through protein-protein interactions (By similarity). Can promote transcription activation through binding to APBB1-KAT5 and inhibit Notch signaling through interaction with Numb (By similarity). Couples to apoptosis-inducing pathways such as those mediated by G(o) and JIP (By similarity). Inhibits G(o)-alpha ATPase activity (By similarity). Acts as a kinesin I membrane receptor, mediating the axonal transport of beta-secretase and presenilin 1 (By similarity). By acting as a kinesin I membrane receptor, plays a role in axonal anterograde transport of cargo towards synapses in axons (By similarity). May be involved in copper homeostasis/oxidative stress through copper ion reduction (By similarity). In vitro, copper-metallated APP induces neuronal death directly or is potentiated through Cu(2+)-mediated low-density lipoprotein oxidation (By similarity). Can regulate neurite outgrowth through binding to components of the extracellular matrix such as heparin and collagen I and IV. Induces a AGER-dependent pathway that involves activation of p38 MAPK, resulting in internalization of amyloid-beta peptide and mitochondrial dysfunction in cultured cortical neurons. Provides Cu(2+) ions for GPC1 which are required for release of nitric oxide (NO) and subsequent degradation of the heparan sulfate chains on GPC1 (By similarity). {ECO:0000250, ECO:0000250|UniProtKB:P05067}.","SUBCELLULAR LOCATION: Cell membrane {ECO:0000250|UniProtKB:P05067}; Single-pass type I membrane protein {ECO:0000250|UniProtKB:P05067}. Membrane {ECO:0000250|UniProtKB:P05067}; Single-pass type I membrane protein {ECO:0000250|UniProtKB:P05067}. Perikaryon {ECO:0000250|UniProtKB:P05067}. Cell projection, growth cone {ECO:0000250|UniProtKB:P05067}. Membrane, clathrin-coated pit {ECO:0000250|UniProtKB:P05067}. Early endosome {ECO:0000250|UniProtKB:P05067}. Cytoplasmic vesicle {ECO:0000250|UniProtKB:P05067}. Note=Cell surface protein that rapidly becomes internalized via clathrin-coated pits. Only a minor proportion is present at the cell membrane; most of the protein is present in intracellular vesicles. During maturation, the immature APP (N-glycosylated in the endoplasmic reticulum) moves to the Golgi complex where complete maturation occurs (O-glycosylated and sulfated). After alpha-secretase cleavage, soluble APP is released into the extracellular space and the C-terminal is internalized to endosomes and lysosomes. Some APP accumulates in secretory transport vesicles leaving the late Golgi compartment and returns to the cell surface. {ECO:0000250|UniProtKB:P05067}.",,UniProt,2026-01-05T01:02:46.025118
Q12830,Nucleosome-remodeling factor subunit BPTF (Bromodomain and PHD finger-containing transcription factor) (Fetal Alz-50 clone 1 protein) (Fetal Alzheimer antigen),BPTF FAC1 FALZ,Homo sapiens (Human),"FUNCTION: Regulatory subunit of the ATP-dependent NURF-1 and NURF-5 ISWI chromatin remodeling complexes, which form ordered nucleosome arrays on chromatin and facilitate access to DNA during DNA-templated processes such as DNA replication, transcription, and repair (PubMed:14609955, PubMed:28801535). The NURF-1 ISWI chromatin remodeling complex has a lower ATP hydrolysis rate than the NURF-5 ISWI chromatin remodeling complex (PubMed:28801535). Within the NURF-1 ISWI chromatin-remodeling complex, binds to the promoters of En1 and En2 to positively regulate their expression and promote brain development (PubMed:14609955). Histone-binding protein which binds to H3 tails trimethylated on 'Lys-4' (H3K4me3), which mark transcription start sites of active genes (PubMed:16728976, PubMed:16728978). Binds to histone H3 tails dimethylated on 'Lys-4' (H3K4Me2) to a lesser extent (PubMed:16728976, PubMed:16728978, PubMed:18042461). May also regulate transcription through direct binding to DNA or transcription factors (PubMed:10575013). {ECO:0000269|PubMed:10575013, ECO:0000269|PubMed:14609955, ECO:0000269|PubMed:16728976, ECO:0000269|PubMed:16728978, ECO:0000269|PubMed:18042461, ECO:0000269|PubMed:28801535}.","SUBCELLULAR LOCATION: Cytoplasm {ECO:0000269|PubMed:15379550}. Nucleus {ECO:0000269|PubMed:10727212, ECO:0000269|PubMed:25593309, ECO:0000269|PubMed:9225734}. Note=Localizes to sites of DNA damage (PubMed:25593309). In brains of Alzheimer disease patients, present in a subset of amyloid-containing plaques (PubMed:10727212). {ECO:0000269|PubMed:10727212, ECO:0000269|PubMed:25593309}.","DISEASE: Neurodevelopmental disorder with dysmorphic facies and distal limb anomalies (NEDDFL) [MIM:617755]: An autosomal dominant neurodevelopmental disorder characterized by variable degrees of developmental delay, intellectual disability, speech delay, postnatal microcephaly, dysmorphic features, and mild abnormalities of the hands and feet. {ECO:0000269|PubMed:28942966}. Note=The disease is caused by variants affecting the gene represented in this entry.",UniProt,2026-01-05T01:02:46.025118
Q92673,Sortilin-related receptor (Low-density lipoprotein receptor relative with 11 ligand-binding repeats) (LDLR relative with 11 ligand-binding repeats) (LR11) (SorLA-1) (Sorting protein-related receptor containing LDLR class A repeats) (SorLA),SORL1 C11orf32,Homo sapiens (Human),"FUNCTION: Sorting receptor that directs several proteins to their correct location within the cell (Probable). Along with AP-1 complex, involved Golgi apparatus - endosome sorting (PubMed:17646382). Sorting receptor for APP, regulating its intracellular trafficking and processing into amyloidogenic-beta peptides. Retains APP in the trans-Golgi network, hence preventing its transit through late endosomes where amyloid beta peptides Abeta40 and Abeta42 are generated (PubMed:16174740, PubMed:16407538, PubMed:17855360, PubMed:24523320). May also sort newly produced amyloid-beta peptides to lysosomes for catabolism (PubMed:24523320). Does not affect APP trafficking from the endoplasmic reticulum to Golgi compartments (PubMed:17855360). Sorting receptor for the BDNF receptor NTRK2/TRKB that facilitates NTRK2 trafficking between synaptic plasma membranes, postsynaptic densities and cell soma, hence positively regulates BDNF signaling by controlling the intracellular location of its receptor (PubMed:23977241). Sorting receptor for GDNF that promotes GDNF regulated, but not constitutive secretion (PubMed:21994944). Sorting receptor for the GDNF-GFRA1 complex, directing it from the cell surface to endosomes. GDNF is then targeted to lysosomes and degraded, while its receptor GFRA1 recycles back to the cell membrane, resulting in a GDNF clearance pathway. The SORL1-GFRA1 complex further targets RET for endocytosis, but not for degradation, affecting GDNF-induced neurotrophic activities (PubMed:23333276). Sorting receptor for ERBB2/HER2. Regulates ERBB2 subcellular distribution by promoting its recycling after internalization from endosomes back to the plasma membrane, hence stimulating phosphoinositide 3-kinase (PI3K)-dependent ERBB2 signaling. In ERBB2-dependent cancer cells, promotes cell proliferation (PubMed:31138794). Sorting receptor for lipoprotein lipase LPL. Promotes LPL localization to endosomes and later to the lysosomes, leading to degradation of newly synthesized LPL (PubMed:21385844). Potential sorting receptor for APOA5, inducing APOA5 internalization to early endosomes, then to late endosomes, wherefrom a portion is sent to lysosomes and degradation, another portion is sorted to the trans-Golgi network (PubMed:18603531). Sorting receptor for the insulin receptor INSR. Promotes recycling of internalized INSR via the Golgi apparatus back to the cell surface, thereby preventing lysosomal INSR catabolism, increasing INSR cell surface expression and strengthening insulin signal reception in adipose tissue. Does not affect INSR internalization (PubMed:27322061). Plays a role in renal ion homeostasis, controlling the phospho-regulation of SLC12A1/NKCC2 by STK39/SPAK kinase and PPP3CB/calcineurin A beta phosphatase, possibly through intracellular sorting of STK39 and PPP3CB (By similarity). Stimulates, via the N-terminal ectodomain, the proliferation and migration of smooth muscle cells, possibly by increasing cell surface expression of the urokinase receptor uPAR/PLAUR. This may promote extracellular matrix proteolysis and hence facilitate cell migration (PubMed:14764453). By acting on the migration of intimal smooth muscle cells, may accelerate intimal thickening following vascular injury (PubMed:14764453). Promotes adhesion of monocytes (PubMed:23486467). Stimulates proliferation and migration of monocytes/macrophages (By similarity). Through its action on intimal smooth muscle cells and macrophages, may accelerate intimal thickening and macrophage foam cell formation in the process of atherosclerosis (By similarity). Regulates hypoxia-enhanced adhesion of hematopoietic stem and progenitor cells to the bone marrow stromal cells via a PLAUR-mediated pathway. This function is mediated by the N-terminal ectodomain (PubMed:23486467). Metabolic regulator, which functions to maintain the adequate balance between lipid storage and oxidation in response to changing environmental conditions, such as temperature and diet. The N-terminal ectodomain negatively regulates adipose tissue energy expenditure, acting through the inhibition the BMP/Smad pathway (By similarity). May regulate signaling by the heterodimeric neurotrophic cytokine CLCF1-CRLF1 bound to the CNTFR receptor by promoting the endocytosis of the tripartite complex CLCF1-CRLF1-CNTFR and lysosomal degradation (PubMed:26858303). May regulate IL6 signaling, decreasing cis signaling, possibly by interfering with IL6-binding to membrane-bound IL6R, while up-regulating trans signaling via soluble IL6R (PubMed:28265003). {ECO:0000250|UniProtKB:O88307, ECO:0000269|PubMed:14764453, ECO:0000269|PubMed:16174740, ECO:0000269|PubMed:16407538, ECO:0000269|PubMed:17646382, ECO:0000269|PubMed:17855360, ECO:0000269|PubMed:18603531, ECO:0000269|PubMed:21385844, ECO:0000269|PubMed:21994944, ECO:0000269|PubMed:23333276, ECO:0000269|PubMed:23486467, ECO:0000269|PubMed:23977241, ECO:0000269|PubMed:24523320, ECO:0000269|PubMed:26858303, ECO:0000269|PubMed:27322061, ECO:0000269|PubMed:28265003, ECO:0000269|PubMed:31138794, ECO:0000305}.","SUBCELLULAR LOCATION: Golgi apparatus membrane {ECO:0000269|PubMed:11294867, ECO:0000269|PubMed:16174740, ECO:0000269|PubMed:17855360, ECO:0000269|PubMed:21385844, ECO:0000269|PubMed:21994944}; Single-pass type I membrane protein {ECO:0000305}. Golgi apparatus, trans-Golgi network membrane {ECO:0000269|PubMed:17646382, ECO:0000269|PubMed:21385844, ECO:0000269|PubMed:23333276}; Single-pass type I membrane protein {ECO:0000305}. Endosome membrane {ECO:0000269|PubMed:21385844, ECO:0000269|PubMed:23333276}; Single-pass type I membrane protein {ECO:0000305}. Early endosome membrane {ECO:0000269|PubMed:16174740, ECO:0000269|PubMed:17646382, ECO:0000269|PubMed:21385844, ECO:0000269|PubMed:31138794}; Single-pass type I membrane protein {ECO:0000305}. Recycling endosome membrane {ECO:0000269|PubMed:17855360, ECO:0000269|PubMed:31138794}; Single-pass type I membrane protein {ECO:0000305}. Endoplasmic reticulum membrane {ECO:0000269|PubMed:17855360, ECO:0000269|PubMed:21385844}; Single-pass type I membrane protein {ECO:0000305}. Endosome, multivesicular body membrane {ECO:0000269|PubMed:21385844, ECO:0000269|PubMed:23333276}; Single-pass type I membrane protein {ECO:0000305}. Cell membrane {ECO:0000269|PubMed:11294867, ECO:0000269|PubMed:14764453, ECO:0000269|PubMed:15053742, ECO:0000269|PubMed:17855360, ECO:0000269|PubMed:21385844, ECO:0000269|PubMed:21994944, ECO:0000269|PubMed:31138794}; Single-pass type I membrane protein {ECO:0000305}. Cytoplasmic vesicle, secretory vesicle membrane {ECO:0000269|PubMed:21994944}; Single-pass type I membrane protein {ECO:0000305}. Secreted {ECO:0000269|PubMed:11082041, ECO:0000269|PubMed:14764453, ECO:0000269|PubMed:15053742, ECO:0000269|PubMed:16393139, ECO:0000269|PubMed:16531402}. Note=Mostly intracellular, predominantly in the trans-Golgi network (TGN) and in endosome, as well as in endosome-to-TGN retrograde vesicles; found at low levels on the plasma membrane (PubMed:11294867, PubMed:15053742, PubMed:17855360, PubMed:21385844, PubMed:21994944, PubMed:31138794). At the cell surface, partially subjected to proteolytic shedding that releases the ectodomain (also called soluble SORLA, solLR11 or sLR11) in the extracellular milieu (PubMed:11082041, PubMed:16393139, PubMed:16531402). The shedding may be catalyzed by ADAM17/TACE (PubMed:16393139). Following shedding, PSEN1/presenilin-1 cleaves the remaining transmembrane fragment and catalyzes the release of a C-terminal fragment in the cytosol and of a soluble N-terminal beta fragment in the extracellular milieu. The C-terminal cytosolic fragment localizes to the nucleus (PubMed:16531402). At the cell surface, the full-length protein undergoes partial clathrin-dependent endocytosis guided by clathrin adapter protein 2 (AP-2) (PubMed:11294867, PubMed:15053742, PubMed:17646382). {ECO:0000269|PubMed:11082041, ECO:0000269|PubMed:11294867, ECO:0000269|PubMed:15053742, ECO:0000269|PubMed:16393139, ECO:0000269|PubMed:16531402, ECO:0000269|PubMed:17646382, ECO:0000269|PubMed:17855360, ECO:0000269|PubMed:21385844, ECO:0000269|PubMed:21994944, ECO:0000269|PubMed:31138794}.","DISEASE: Alzheimer disease (AD) [MIM:104300]: Alzheimer disease is a neurodegenerative disorder characterized by progressive dementia, loss of cognitive abilities, and deposition of fibrillar amyloid proteins as intraneuronal neurofibrillary tangles, extracellular amyloid plaques and vascular amyloid deposits. The major constituents of these plaques are neurotoxic amyloid-beta protein 40 and amyloid-beta protein 42, that are produced by the proteolysis of the transmembrane APP protein. The cytotoxic C-terminal fragments (CTFs) and the caspase-cleaved products, such as C31, are also implicated in neuronal death. {ECO:0000269|PubMed:21220680, ECO:0000269|PubMed:22472873, ECO:0000269|PubMed:23565137, ECO:0000269|PubMed:24523320}. Note=The gene represented in this entry may be involved in disease pathogenesis.",UniProt,2026-01-05T01:02:46.025118
