uniprot_id,protein_name,gene_name,organism,function,subcellular_location,disease_association,data_source,integration_date
P07339,Cathepsin D (EC 3.4.23.5) [Cleaved into: Cathepsin D light chain; Cathepsin D heavy chain],CTSD CPSD,Homo sapiens (Human),FUNCTION: Acid protease active in intracellular protein breakdown. Plays a role in APP processing following cleavage and activation by ADAM30 which leads to APP degradation (PubMed:27333034). Involved in the pathogenesis of several diseases such as breast cancer and possibly Alzheimer disease. {ECO:0000269|PubMed:27333034}.,"SUBCELLULAR LOCATION: Lysosome. Melanosome. Secreted, extracellular space. Note=Identified by mass spectrometry in melanosome fractions from stage I to stage IV. In aortic samples, detected as an extracellular protein loosely bound to the matrix (PubMed:20551380). {ECO:0000269|PubMed:20551380}.","DISEASE: Ceroid lipofuscinosis, neuronal, 10 (CLN10) [MIM:610127]: A form of neuronal ceroid lipofuscinosis with onset at birth or early childhood. Neuronal ceroid lipofuscinoses are progressive neurodegenerative, lysosomal storage diseases characterized by intracellular accumulation of autofluorescent liposomal material, and clinically by seizures, dementia, visual loss, and/or cerebral atrophy. {ECO:0000269|PubMed:16670177, ECO:0000269|PubMed:16685649, ECO:0000269|PubMed:21990111}. Note=The disease is caused by variants affecting the gene represented in this entry.",UniProt,2026-01-05T01:02:46.025118
P37840,Alpha-synuclein (Non-A beta component of AD amyloid) (Non-A4 component of amyloid precursor) (NACP),SNCA NACP PARK1,Homo sapiens (Human),"FUNCTION: Neuronal protein that plays several roles in synaptic activity such as regulation of synaptic vesicle trafficking and subsequent neurotransmitter release (PubMed:20798282, PubMed:26442590, PubMed:28288128, PubMed:30404828). Participates as a monomer in synaptic vesicle exocytosis by enhancing vesicle priming, fusion and dilation of exocytotic fusion pores (PubMed:28288128, PubMed:30404828). Mechanistically, acts by increasing local Ca(2+) release from microdomains which is essential for the enhancement of ATP-induced exocytosis (PubMed:30404828). Also acts as a molecular chaperone in its multimeric membrane-bound state, assisting in the folding of synaptic fusion components called SNAREs (Soluble NSF Attachment Protein REceptors) at presynaptic plasma membrane in conjunction with cysteine string protein-alpha/DNAJC5 (PubMed:20798282). This chaperone activity is important to sustain normal SNARE-complex assembly during aging (PubMed:20798282). Also plays a role in the regulation of the dopamine neurotransmission by associating with the dopamine transporter (DAT1) and thereby modulating its activity (PubMed:26442590). {ECO:0000269|PubMed:20798282, ECO:0000269|PubMed:26442590, ECO:0000269|PubMed:28288128, ECO:0000269|PubMed:30404828}.","SUBCELLULAR LOCATION: Cytoplasm {ECO:0000269|PubMed:19762560, ECO:0000269|PubMed:24936070, ECO:0000269|PubMed:25561023, ECO:0000269|PubMed:26442590, ECO:0000269|PubMed:31034892, ECO:0000269|PubMed:33657088}. Membrane {ECO:0000269|PubMed:24936070}. Nucleus {ECO:0000269|PubMed:12859192, ECO:0000269|PubMed:24936070}. Synapse {ECO:0000269|PubMed:15282274}. Secreted {ECO:0000269|PubMed:24936070}. Cell projection, axon {ECO:0000250|UniProtKB:O55042}. Note=Membrane-bound in dopaminergic neurons (PubMed:15282274). Expressed and colocalized with SEPTIN4 in dopaminergic axon terminals, especially at the varicosities (By similarity). {ECO:0000250|UniProtKB:O55042, ECO:0000269|PubMed:15282274}.","DISEASE: Note=Genetic alterations of SNCA resulting in aberrant polymerization into fibrils, are associated with several neurodegenerative diseases (synucleinopathies). SNCA fibrillar aggregates represent the major non A-beta component of Alzheimer disease amyloid plaque, and a major component of Lewy body inclusions. They are also found within Lewy body (LB)-like intraneuronal inclusions, glial inclusions and axonal spheroids in neurodegeneration with brain iron accumulation type 1.; DISEASE: Parkinson disease 1, autosomal dominant (PARK1) [MIM:168601]: A complex neurodegenerative disorder characterized by bradykinesia, resting tremor, muscular rigidity and postural instability. Additional features are characteristic postural abnormalities, dysautonomia, dystonic cramps, and dementia. The pathology of Parkinson disease involves the loss of dopaminergic neurons in the substantia nigra and the presence of Lewy bodies (intraneuronal accumulations of aggregated proteins), in surviving neurons in various areas of the brain. The disease is progressive and usually manifests after the age of 50 years, although early-onset cases (before 50 years) are known. The majority of the cases are sporadic suggesting a multifactorial etiology based on environmental and genetic factors. However, some patients present with a positive family history for the disease. Familial forms of the disease usually begin at earlier ages and are associated with atypical clinical features. {ECO:0000269|PubMed:14755719, ECO:0000269|PubMed:23427326, ECO:0000269|PubMed:23457019, ECO:0000269|PubMed:24936070, ECO:0000269|PubMed:25561023, ECO:0000269|PubMed:9197268, ECO:0000269|PubMed:9462735}. Note=The disease is caused by variants affecting the gene represented in this entry.; DISEASE: Parkinson disease 4, autosomal dominant (PARK4) [MIM:605543]: A complex neurodegenerative disorder with manifestations ranging from typical Parkinson disease to dementia with Lewy bodies. Clinical features include parkinsonian symptoms (resting tremor, rigidity, postural instability and bradykinesia), dementia, diffuse Lewy body pathology, autonomic dysfunction, hallucinations and paranoia. Note=The disease is caused by variants affecting the gene represented in this entry.; DISEASE: Dementia, Lewy body (DLB) [MIM:127750]: A neurodegenerative disorder characterized by mental impairment leading to dementia, parkinsonism, fluctuating cognitive function, visual hallucinations, falls, syncopal episodes, and sensitivity to neuroleptic medication. Brainstem or cortical intraneuronal accumulations of aggregated proteins (Lewy bodies) are the only essential pathologic features. Patients may also have hippocampal and neocortical senile plaques, sometimes in sufficient number to fulfill the diagnostic criteria for Alzheimer disease. {ECO:0000269|PubMed:14755719}. Note=The disease is caused by variants affecting the gene represented in this entry.",UniProt,2026-01-05T01:02:46.025118
P53041,Serine/threonine-protein phosphatase 5 (PP5) (EC 3.1.3.16) (Protein phosphatase T) (PP-T) (PPT),PPP5C PPP5,Homo sapiens (Human),"FUNCTION: Serine/threonine-protein phosphatase that dephosphorylates a myriad of proteins involved in different signaling pathways including the kinases CSNK1E, ASK1/MAP3K5, PRKDC and RAF1, the nuclear receptors NR3C1, PPARG, ESR1 and ESR2, SMAD proteins and TAU/MAPT (PubMed:14734805, PubMed:14764652, PubMed:14871926, PubMed:15383005, PubMed:15546861, PubMed:16260606, PubMed:16790549, PubMed:16892053, PubMed:19176521, PubMed:19948726, PubMed:21144835, PubMed:22399290, PubMed:22781750, PubMed:23102700, PubMed:30699359, PubMed:9000529). Implicated in wide ranging cellular processes, including apoptosis, differentiation, DNA damage response, cell survival, regulation of ion channels or circadian rhythms, in response to steroid and thyroid hormones, calcium, fatty acids, TGF-beta as well as oxidative and genotoxic stresses (PubMed:14734805, PubMed:14764652, PubMed:14871926, PubMed:15383005, PubMed:15546861, PubMed:16260606, PubMed:16790549, PubMed:16892053, PubMed:19176521, PubMed:19948726, PubMed:21144835, PubMed:22399290, PubMed:22781750, PubMed:23102700, PubMed:30699359, PubMed:9000529). Participates in the control of DNA damage response mechanisms such as checkpoint activation and DNA damage repair through, for instance, the regulation ATM/ATR-signaling and dephosphorylation of PRKDC and TP53BP1 (PubMed:14871926, PubMed:16260606, PubMed:21144835). Inhibits ASK1/MAP3K5-mediated apoptosis induced by oxidative stress (PubMed:23102700). Plays a positive role in adipogenesis, mainly through the dephosphorylation and activation of PPARG transactivation function (By similarity). Also dephosphorylates and inhibits the anti-adipogenic effect of NR3C1 (By similarity). Regulates the circadian rhythms, through the dephosphorylation and activation of CSNK1E (PubMed:16790549). May modulate TGF-beta signaling pathway by the regulation of SMAD3 phosphorylation and protein expression levels (PubMed:22781750). Dephosphorylates and may play a role in the regulation of TAU/MAPT (PubMed:15546861). Through their dephosphorylation, may play a role in the regulation of ions channels such as KCNH2 (By similarity). Dephosphorylate FNIP1, disrupting interaction with HSP90AA1/Hsp90 (PubMed:30699359). {ECO:0000250|UniProtKB:P53042, ECO:0000250|UniProtKB:Q60676, ECO:0000269|PubMed:14734805, ECO:0000269|PubMed:14764652, ECO:0000269|PubMed:14871926, ECO:0000269|PubMed:15383005, ECO:0000269|PubMed:15546861, ECO:0000269|PubMed:16260606, ECO:0000269|PubMed:16790549, ECO:0000269|PubMed:16892053, ECO:0000269|PubMed:19176521, ECO:0000269|PubMed:19948726, ECO:0000269|PubMed:21144835, ECO:0000269|PubMed:22399290, ECO:0000269|PubMed:22781750, ECO:0000269|PubMed:23102700, ECO:0000269|PubMed:30699359, ECO:0000269|PubMed:9000529}.","SUBCELLULAR LOCATION: Nucleus {ECO:0000269|PubMed:15383005}. Cytoplasm {ECO:0000269|PubMed:15383005, ECO:0000269|PubMed:19948726}. Cell membrane {ECO:0000269|PubMed:19948726}. Note=Predominantly nuclear (PubMed:15383005). But also present in the cytoplasm (PubMed:15383005). Translocates from the cytoplasm to the plasma membrane in a RAC1-dependent manner (PubMed:19948726). {ECO:0000269|PubMed:15383005, ECO:0000269|PubMed:19948726}.",,UniProt,2026-01-05T01:02:46.025118
Q8IZY2,Phospholipid-transporting ATPase ABCA7 (EC 7.6.2.1) (ABCA-SSN) (ATP-binding cassette sub-family A member 7) (Autoantigen SS-N) (Macrophage ABC transporter),ABCA7,Homo sapiens (Human),"FUNCTION: Catalyzes the translocation of specific phospholipids from the cytoplasmic to the extracellular/lumenal leaflet of membrane coupled to the hydrolysis of ATP (PubMed:24097981). Transports preferentially phosphatidylserine over phosphatidylcholine (PubMed:24097981). Plays a role in lipid homeostasis and macrophage-mediated phagocytosis (PubMed:12917409, PubMed:12925201, PubMed:14570867, PubMed:14592415). Binds APOA1 and may function in apolipoprotein-mediated phospholipid efflux from cells (PubMed:12917409, PubMed:14570867, PubMed:14592415). May also mediate cholesterol efflux (PubMed:14570867). May regulate cellular ceramide homeostasis during keratinocyte differentiation (PubMed:12925201). Involved in lipid raft organization and CD1D localization on thymocytes and antigen-presenting cells, which plays an important role in natural killer T-cell development and activation (By similarity). Plays a role in phagocytosis of apoptotic cells by macrophages (By similarity). Macrophage phagocytosis is stimulated by APOA1 or APOA2, probably by stabilization of ABCA7 (By similarity). Also involved in phagocytic clearance of amyloid-beta by microglia cells and macrophages (By similarity). Further limits amyloid-beta production by playing a role in the regulation of amyloid-beta A4 precursor protein (APP) endocytosis and/or processing (PubMed:26260791). Amyloid-beta is the main component of amyloid plaques found in the brains of Alzheimer patients (PubMed:26260791). {ECO:0000250|UniProtKB:Q91V24, ECO:0000269|PubMed:12917409, ECO:0000269|PubMed:12925201, ECO:0000269|PubMed:14570867, ECO:0000269|PubMed:14592415, ECO:0000269|PubMed:24097981, ECO:0000269|PubMed:26260791}.","SUBCELLULAR LOCATION: Cell membrane {ECO:0000269|PubMed:12917409, ECO:0000269|PubMed:14592415}; Multi-pass membrane protein {ECO:0000255}. Golgi apparatus membrane {ECO:0000250|UniProtKB:Q91V24}; Multi-pass membrane protein {ECO:0000255}. Early endosome membrane {ECO:0000250|UniProtKB:Q91V24}; Multi-pass membrane protein {ECO:0000255}. Cytoplasm {ECO:0000250|UniProtKB:Q91V24}. Cell projection, ruffle membrane {ECO:0000250|UniProtKB:Q91V24}. Cell projection, phagocytic cup {ECO:0000250|UniProtKB:Q91V24}. Note=Localizes to cell membrane ruffles and phagocytic cups of macrophages stimulated with C1q or apoptotic cells. Localizes to the cytoplasm of resting macrophages, probably in Golgi and endosomes. Localizes to the apical brush border of cells in the proximal tubules of kidney (By similarity). {ECO:0000250|UniProtKB:Q91V24}.; SUBCELLULAR LOCATION: [Isoform 2]: Cytoplasm {ECO:0000269|PubMed:14592415}. Endoplasmic reticulum {ECO:0000269|PubMed:14592415}. Note=May localize to the endoplasmic reticulum. {ECO:0000269|PubMed:14592415}.","DISEASE: Alzheimer disease 9 (AD9) [MIM:608907]: A familial, late-onset form of Alzheimer disease. Alzheimer disease is a neurodegenerative disorder characterized by progressive dementia, loss of cognitive abilities, and deposition of fibrillar amyloid proteins as intraneuronal neurofibrillary tangles, extracellular amyloid plaques and vascular amyloid deposits. The major constituents of these plaques are neurotoxic amyloid-beta protein 40 and amyloid-beta protein 42, that are produced by the proteolysis of the transmembrane APP protein. The cytotoxic C-terminal fragments (CTFs) and the caspase-cleaved products, such as C31, are also implicated in neuronal death. {ECO:0000269|PubMed:25807283, ECO:0000269|PubMed:26141617, ECO:0000269|PubMed:29577078}. Note=Disease susceptibility is associated with variants affecting the gene represented in this entry.",UniProt,2026-01-05T01:02:46.025118
O14672,Disintegrin and metalloproteinase domain-containing protein 10 (ADAM 10) (EC 3.4.24.81) (CDw156) (Kuzbanian protein homolog) (Mammalian disintegrin-metalloprotease) (CD antigen CD156c),ADAM10 KUZ MADM,Homo sapiens (Human),"FUNCTION: Transmembrane metalloprotease which mediates the ectodomain shedding of a myriad of transmembrane proteins, including adhesion proteins, growth factor precursors and cytokines being essential for development and tissue homeostasis (PubMed:11786905, PubMed:12475894, PubMed:20592283, PubMed:24990881, PubMed:26686862, PubMed:28600292, PubMed:31792032). Associates with six members of the tetraspanin superfamily TspanC8 which regulate its exit from the endoplasmic reticulum and its substrate selectivity (PubMed:26686862, PubMed:28600292, PubMed:31792032, PubMed:34739841, PubMed:37516108). Cleaves the membrane-bound precursor of TNF-alpha at '76-Ala-|-Val-77' to its mature soluble form. Responsible for the proteolytical release of soluble JAM3 from endothelial cells surface (PubMed:20592283). Responsible for the proteolytic release of several other cell-surface proteins, including heparin-binding epidermal growth-like factor, ephrin-A2, CD44, CDH2 and for constitutive and regulated alpha-secretase cleavage of amyloid precursor protein (APP) (PubMed:11786905, PubMed:26686862, PubMed:29224781, PubMed:34739841). Contributes to the normal cleavage of the cellular prion protein (PubMed:11477090). Involved in the cleavage of the adhesion molecule L1 at the cell surface and in released membrane vesicles, suggesting a vesicle-based protease activity (PubMed:12475894). Also controls the proteolytic processing of Notch and mediates lateral inhibition during neurogenesis (By similarity). Required for the development of type 1 transitional B cells into marginal zone B cells, probably by cleaving Notch (By similarity). Responsible for the FasL ectodomain shedding and for the generation of the remnant ADAM10-processed FasL (FasL APL) transmembrane form (PubMed:17557115). Also cleaves the ectodomain of the integral membrane proteins CORIN and ITM2B (PubMed:19114711, PubMed:21288900). Mediates the proteolytic cleavage of LAG3, leading to release the secreted form of LAG3 (By similarity). Mediates the proteolytic cleavage of IL6R and IL11RA, leading to the release of secreted forms of IL6R and IL11RA (PubMed:26876177). Enhances the cleavage of CHL1 by BACE1 (By similarity). Cleaves NRCAM (By similarity). Cleaves TREM2, resulting in shedding of the TREM2 ectodomain (PubMed:24990881). Involved in the development and maturation of glomerular and coronary vasculature (By similarity). During development of the cochlear organ of Corti, promotes pillar cell separation by forming a ternary complex with CADH1 and EPHA4 and cleaving CADH1 at adherens junctions (By similarity). May regulate the EFNA5-EPHA3 signaling (PubMed:16239146). Regulates leukocyte transmigration as a sheddase for the adherens junction protein VE-cadherin/CDH5 in endothelial cells (PubMed:28600292). {ECO:0000250|UniProtKB:O35598, ECO:0000269|PubMed:11477090, ECO:0000269|PubMed:11786905, ECO:0000269|PubMed:12475894, ECO:0000269|PubMed:16239146, ECO:0000269|PubMed:17557115, ECO:0000269|PubMed:19114711, ECO:0000269|PubMed:20592283, ECO:0000269|PubMed:21288900, ECO:0000269|PubMed:24990881, ECO:0000269|PubMed:26686862, ECO:0000269|PubMed:26876177, ECO:0000269|PubMed:28600292, ECO:0000269|PubMed:29224781, ECO:0000269|PubMed:31792032, ECO:0000269|PubMed:34739841, ECO:0000269|PubMed:37516108}.; FUNCTION: (Microbial infection) Promotes the cytotoxic activity of S.aureus hly by binding to the toxin at zonula adherens and promoting formation of toxin pores. {ECO:0000269|PubMed:20624979, ECO:0000269|PubMed:30463011}.","SUBCELLULAR LOCATION: Cell membrane {ECO:0000269|PubMed:20624979, ECO:0000269|PubMed:23676497, ECO:0000269|PubMed:24990881, ECO:0000269|PubMed:26686862, ECO:0000269|PubMed:29430990, ECO:0000269|PubMed:30463011}; Single-pass type I membrane protein {ECO:0000305}. Golgi apparatus membrane {ECO:0000269|PubMed:12475894}; Single-pass type I membrane protein {ECO:0000305}. Cytoplasmic vesicle, clathrin-coated vesicle {ECO:0000269|PubMed:12475894}. Cell projection, axon {ECO:0000250|UniProtKB:O35598}. Cell projection, dendrite {ECO:0000250|UniProtKB:O35598}. Cell junction, adherens junction {ECO:0000269|PubMed:30463011}. Cytoplasm {ECO:0000269|PubMed:30463011}. Note=Is localized in the plasma membrane but is also expressed in the Golgi apparatus and in clathrin-coated vesicles derived likely from the Golgi (PubMed:12475894). During long term depression, it is recruited to the cell membrane by DLG1 (PubMed:23676497). The immature form is mainly located near cytoplasmic fibrillar structures, while the mature form is predominantly located at zonula adherens and the cell membrane (PubMed:30463011). The localization and clustering of mature ADAM10 to zonula adherens is regulated by AFDN, TSPAN33, PLEKHA7 and PDZD11 (PubMed:30463011). {ECO:0000269|PubMed:12475894, ECO:0000269|PubMed:23676497, ECO:0000269|PubMed:30463011}.","DISEASE: Reticulate acropigmentation of Kitamura (RAK) [MIM:615537]: A rare cutaneous pigmentation disorder characterized by reticulate, slightly depressed, sharply demarcated brown macules without hypopigmentation, affecting the dorsa of the hands and feet and appearing in the first or second decade of life. The macules gradually darken and extend to the proximal regions of the extremities. The manifestations tend to progress until middle age, after which progression of the eruptions stops. The pigmentary augmentation is found on the flexor aspects of the wrists, neck, patella and olecranon. Other features include breaks in the epidermal ridges on the palms and fingers, palmoplantar pits, occasionally plantar keratoderma, and partial alopecia. {ECO:0000269|PubMed:23666529}. Note=The disease is caused by variants affecting the gene represented in this entry.; DISEASE: Alzheimer disease 18 (AD18) [MIM:615590]: A late-onset form of Alzheimer disease. Alzheimer disease is a neurodegenerative disorder characterized by progressive dementia, loss of cognitive abilities, and deposition of fibrillar amyloid proteins as intraneuronal neurofibrillary tangles, extracellular amyloid plaques and vascular amyloid deposits. The major constituents of these plaques are neurotoxic amyloid-beta protein 40 and amyloid-beta protein 42, that are produced by the proteolysis of the transmembrane APP protein. The cytotoxic C-terminal fragments (CTFs) and the caspase-cleaved products, such as C31, are also implicated in neuronal death. {ECO:0000269|PubMed:19608551, ECO:0000269|PubMed:24055016}. Note=Disease susceptibility is associated with variants affecting the gene represented in this entry.",UniProt,2026-01-05T01:02:46.025118
P03886,NADH-ubiquinone oxidoreductase chain 1 (EC 7.1.1.2) (NADH dehydrogenase subunit 1),MT-ND1 MTND1 NADH1 ND1,Homo sapiens (Human),"FUNCTION: Core subunit of the mitochondrial membrane respiratory chain NADH dehydrogenase (Complex I) which catalyzes electron transfer from NADH through the respiratory chain, using ubiquinone as an electron acceptor (PubMed:1959619). Essential for the catalytic activity and assembly of complex I (PubMed:1959619, PubMed:26929434). {ECO:0000269|PubMed:1959619, ECO:0000269|PubMed:26929434}.",SUBCELLULAR LOCATION: Mitochondrion inner membrane {ECO:0000250|UniProtKB:P03887}; Multi-pass membrane protein {ECO:0000255}.,"DISEASE: Leber hereditary optic neuropathy (LHON) [MIM:535000]: A maternally inherited form of Leber hereditary optic neuropathy, a mitochondrial disease resulting in bilateral painless loss of central vision due to selective degeneration of the retinal ganglion cells and their axons. The disorder shows incomplete penetrance and male predominance. Cardiac conduction defects and neurological defects have also been described in some LHON patients. LHON results from primary mitochondrial DNA mutations affecting the respiratory chain complexes. {ECO:0000269|PubMed:1417830, ECO:0000269|PubMed:1674640, ECO:0000269|PubMed:1900003, ECO:0000269|PubMed:1928099, ECO:0000269|PubMed:1959619, ECO:0000269|PubMed:2018041}. Note=The disease is caused by variants affecting the gene represented in this entry.; DISEASE: Mitochondrial encephalomyopathy with lactic acidosis and stroke-like episodes syndrome (MELAS) [MIM:540000]: Genetically heterogeneous disorder, characterized by episodic vomiting, seizures, and recurrent cerebral insults resembling strokes and causing hemiparesis, hemianopsia, or cortical blindness. {ECO:0000269|PubMed:8723687}. Note=The disease is caused by variants affecting the gene represented in this entry.; DISEASE: Alzheimer disease mitochondrial (AD-MT) [MIM:502500]: Alzheimer disease is a neurodegenerative disorder characterized by progressive dementia, loss of cognitive abilities, and deposition of fibrillar amyloid proteins as intraneuronal neurofibrillary tangles, extracellular amyloid plaques and vascular amyloid deposits. The major constituents of these plaques are neurotoxic amyloid-beta protein 40 and amyloid-beta protein 42, that are produced by the proteolysis of the transmembrane APP protein. The cytotoxic C-terminal fragments (CTFs) and the caspase-cleaved products, such as C31, are also implicated in neuronal death. {ECO:0000269|PubMed:8104867}. Note=Disease susceptibility may be associated with variants affecting the gene represented in this entry.; DISEASE: Type 2 diabetes mellitus (T2D) [MIM:125853]: A multifactorial disorder of glucose homeostasis caused by a lack of sensitivity to insulin. Affected individuals usually have an obese body habitus and manifestations of a metabolic syndrome characterized by diabetes, insulin resistance, hypertension and hypertriglyceridemia. The disease results in long-term complications that affect the eyes, kidneys, nerves, and blood vessels. {ECO:0000269|PubMed:15265369, ECO:0000269|PubMed:7733935}. Note=The gene represented in this entry may be involved in disease pathogenesis.",UniProt,2026-01-05T01:02:46.025118
