uniprot_id,protein_name,gene_name,organism,function,subcellular_location,disease_association,data_source,integration_date
P21554,Cannabinoid receptor 1 (CB-R) (CB1) (CANN6),CNR1 CNR,Homo sapiens (Human),"FUNCTION: G-protein coupled receptor for endogenous cannabinoids (eCBs), including N-arachidonoylethanolamide (also called anandamide or AEA) and 2-arachidonoylglycerol (2-AG), as well as phytocannabinoids, such as delta(9)-tetrahydrocannabinol (THC) (PubMed:15620723, PubMed:27768894, PubMed:27851727). Mediates many cannabinoid-induced effects, acting, among others, on food intake, memory loss, gastrointestinal motility, catalepsy, ambulatory activity, anxiety, chronic pain. Signaling typically involves reduction in cyclic AMP (PubMed:1718258, PubMed:21895628, PubMed:27768894). In the hypothalamus, may have a dual effect on mitochondrial respiration depending upon the agonist dose and possibly upon the cell type. Increases respiration at low doses, while decreases respiration at high doses. At high doses, CNR1 signal transduction involves G-protein alpha-i protein activation and subsequent inhibition of mitochondrial soluble adenylate cyclase, decrease in cyclic AMP concentration, inhibition of protein kinase A (PKA)-dependent phosphorylation of specific subunits of the mitochondrial electron transport system, including NDUFS2. In the hypothalamus, inhibits leptin-induced reactive oxygen species (ROS) formation and mediates cannabinoid-induced increase in SREBF1 and FASN gene expression. In response to cannabinoids, drives the release of orexigenic beta-endorphin, but not that of melanocyte-stimulating hormone alpha/alpha-MSH, from hypothalamic POMC neurons, hence promoting food intake. In the hippocampus, regulates cellular respiration and energy production in response to cannabinoids. Involved in cannabinoid-dependent depolarization-induced suppression of inhibition (DSI), a process in which depolarization of CA1 postsynaptic pyramidal neurons mobilizes eCBs, which retrogradely activate presynaptic CB1 receptors, transiently decreasing GABAergic inhibitory neurotransmission. Also reduces excitatory synaptic transmission (By similarity). In superior cervical ganglions and cerebral vascular smooth muscle cells, inhibits voltage-gated Ca(2+) channels in a constitutive, as well as agonist-dependent manner (PubMed:17895407). In cerebral vascular smooth muscle cells, cannabinoid-induced inhibition of voltage-gated Ca(2+) channels leads to vasodilation and decreased vascular tone (By similarity). Induces leptin production in adipocytes and reduces LRP2-mediated leptin clearance in the kidney, hence participating in hyperleptinemia. In adipose tissue, CNR1 signaling leads to increased expression of SREBF1, ACACA and FASN genes (By similarity). In the liver, activation by endocannabinoids leads to increased de novo lipogenesis and reduced fatty acid catabolism, associated with increased expression of SREBF1/SREBP-1, GCK, ACACA, ACACB and FASN genes. May also affect de novo cholesterol synthesis and HDL-cholesteryl ether uptake. Peripherally modulates energy metabolism (By similarity). In high carbohydrate diet-induced obesity, may decrease the expression of mitochondrial dihydrolipoyl dehydrogenase/DLD in striated muscles, as well as that of selected glucose/ pyruvate metabolic enzymes, hence affecting energy expenditure through mitochondrial metabolism (By similarity). In response to cannabinoid anandamide, elicits a pro-inflammatory response in macrophages, which involves NLRP3 inflammasome activation and IL1B and IL18 secretion (By similarity). In macrophages infiltrating pancreatic islets, this process may participate in the progression of type-2 diabetes and associated loss of pancreatic beta-cells (PubMed:23955712). {ECO:0000250|UniProtKB:O02777, ECO:0000250|UniProtKB:P47746, ECO:0000269|PubMed:15620723, ECO:0000269|PubMed:1718258, ECO:0000269|PubMed:17895407, ECO:0000269|PubMed:21895628, ECO:0000269|PubMed:23955712, ECO:0000269|PubMed:27768894, ECO:0000269|PubMed:27851727}.; FUNCTION: [Isoform 1]: Binds both 2-arachidonoylglycerol (2-AG) and anandamide. {ECO:0000269|PubMed:15620723}.; FUNCTION: [Isoform 2]: Only binds 2-arachidonoylglycerol (2-AG) with high affinity. Contrary to its effect on isoform 1, 2-AG behaves as an inverse agonist on isoform 2 in assays measuring GTP binding to membranes. {ECO:0000269|PubMed:15620723}.; FUNCTION: [Isoform 3]: Only binds 2-arachidonoylglycerol (2-AG) with high affinity. Contrary to its effect on isoform 1, 2-AG behaves as an inverse agonist on isoform 3 in assays measuring GTP binding to membranes. {ECO:0000269|PubMed:15620723}.","SUBCELLULAR LOCATION: Cell membrane {ECO:0000269|PubMed:21895628}; Multi-pass membrane protein {ECO:0000269|PubMed:27768894, ECO:0000269|PubMed:27851727}. Membrane raft {ECO:0000269|PubMed:21895628}. Mitochondrion outer membrane {ECO:0000250|UniProtKB:P47746}. Cell projection, axon {ECO:0000250|UniProtKB:P20272}. Presynapse {ECO:0000250|UniProtKB:P20272}. Note=Unexpectedly, in the mitochondria, the C-terminus is located in the mitochondrial intermembrane space, a compartment topologically considered as extracellular. In canonical seven-transmembrane G-protein coupled receptors, the C-terminus is cytosolic (By similarity). Found on presynaptic axon terminals in some GABAergic neurons in the somatosensory cortex (By similarity). {ECO:0000250|UniProtKB:P20272, ECO:0000250|UniProtKB:P47746}.","DISEASE: Obesity (OBESITY) [MIM:601665]: A condition characterized by an increase of body weight beyond the limitation of skeletal and physical requirements, as the result of excessive accumulation of body fat. {ECO:0000269|PubMed:18177726}. Note=The protein represented in this entry may be involved in disease pathogenesis. May contribute to the development of diet-induced obesity and several obesity-associated features, such as dyslipidemia and liver steatosis, regulating peripheral lipogenesis, energy expenditure and feeding behavior. CNR1 inverse agonists have been shown to reduce body weight and improve metabolic abnormalities in obese subjects, although adverse neuropsychiatric effects, including anxiety, irritability, and depressed mood, halted their therapeutic development (PubMed:18177726). In obese mice, peripherally restricted CNR1 inverse agonists have been shown to normalize metabolic abnormalities, including insulin resistance and fatty liver, and to reverse leptin resistance. {ECO:0000269|PubMed:18177726}.; DISEASE: Note=Dysfunction of the endogenous cannabinoid system including CNR1 has been implicated in the pathogenesis of a number of central nervous system disorders, including Huntington disease, Parkinson disease, and Alzheimer disease (PubMed:32549916). In post-mortem brains from Huntington disease patients, a progressive CNR1 loss has been observed in the caudate nucleus, putamen, and substantia nigra pars reticulata, and altered expression and abnormal endocannabinoid levels precede motor symptoms in a disease mouse model (PubMed:10828533, PubMed:19524019, PubMed:8255419). In Parkinson disease, low CNR1 expression in mid-superior frontal gyrus and mid-cingulate cortex has been associated with poor mind, poor executive functioning and poor episode memory, while patients with more severe visuospatial dysfunction showed decreased receptor availability in the precuneus, mid-cingulate, supplementary motor cortex, inferior orbitofrontal gyrus and thalamus (PubMed:31342135). In an animal model for Alzheimer disease, CNR1 heterozygous deletion has been associated with decreased levels of postsynaptic density protein 95 (DLG4/PSD95) and accelerated memory impairment, suggesting synaptic dysfunction and a crucial role for CNR1 in the progression of disease symptoms (PubMed:10828533, PubMed:19524019, PubMed:30096288, PubMed:31342135, PubMed:8255419). {ECO:0000269|PubMed:10828533, ECO:0000269|PubMed:19524019, ECO:0000269|PubMed:30096288, ECO:0000269|PubMed:31342135, ECO:0000269|PubMed:32549916, ECO:0000269|PubMed:8255419}.",UniProt,2026-01-05T01:02:46.025118
Q9P0L2,Serine/threonine-protein kinase MARK1 (EC 2.7.11.1) (EC 2.7.11.26) (MAP/microtubule affinity-regulating kinase 1) (PAR1 homolog c) (Par-1c) (Par1c),MARK1 KIAA1477 MARK,Homo sapiens (Human),"FUNCTION: Serine/threonine-protein kinase (PubMed:23666762). Involved in cell polarity and microtubule dynamics regulation. Phosphorylates DCX, MAP2 and MAP4. Phosphorylates the microtubule-associated protein MAPT/TAU (PubMed:23666762). Involved in cell polarity by phosphorylating the microtubule-associated proteins MAP2, MAP4 and MAPT/TAU at KXGS motifs, causing detachment from microtubules, and their disassembly. Involved in the regulation of neuronal migration through its dual activities in regulating cellular polarity and microtubule dynamics, possibly by phosphorylating and regulating DCX. Also acts as a positive regulator of the Wnt signaling pathway, probably by mediating phosphorylation of dishevelled proteins (DVL1, DVL2 and/or DVL3). {ECO:0000269|PubMed:11433294, ECO:0000269|PubMed:17573348, ECO:0000269|PubMed:23666762}.","SUBCELLULAR LOCATION: Cell membrane {ECO:0000269|PubMed:21145462}; Peripheral membrane protein {ECO:0000269|PubMed:21145462}. Cytoplasm, cytoskeleton {ECO:0000250}. Cytoplasm {ECO:0000269|PubMed:23666762}. Cell projection, dendrite {ECO:0000269|PubMed:23666762}. Note=Appears to localize to an intracellular network. {ECO:0000250}.",DISEASE: Note=Genetic variations in MARK1 may be associated with susceptibility to autism. MARK1 is overexpressed in the prefrontal cortex of patients with autism and causes changes in the function of cortical dendrites.,UniProt,2026-01-05T01:02:46.025118
Q99MQ5,Collagen alpha-1(XXV) chain (CLAC-P) [Cleaved into: Collagen-like Alzheimer amyloid plaque component (CLAC)],Col25a1,Mus musculus (Mouse),FUNCTION: Inhibits fibrillization of amyloid-beta peptide during the elongation phase. Has also been shown to assemble amyloid fibrils into protease-resistant aggregates. Binds heparin (By similarity). {ECO:0000250|UniProtKB:Q9BXS0}.,"SUBCELLULAR LOCATION: Membrane {ECO:0000305}; Single-pass type II membrane protein {ECO:0000305}. Note=After proteolytic cleavage, CLAC is secreted. {ECO:0000250}.",,UniProt,2026-01-05T01:02:46.025118
O73683,Amyloid-beta A4 protein (ABPP) (APP) (Alzheimer disease amyloid A4 protein homolog) (Amyloid precursor protein) (Amyloid-beta precursor protein) [Cleaved into: Amyloid-beta protein (A-beta) (APP-beta)],app,Dichotomyctere fluviatilis (Green pufferfish) (Tetraodon fluviatilis),FUNCTION: Functional neuronal receptor which couples to intracellular signaling pathway through the GTP-binding protein G(O). {ECO:0000250}.,SUBCELLULAR LOCATION: Membrane; Single-pass type I membrane protein.,,UniProt,2026-01-05T01:02:46.025118
O93279,Amyloid-beta A4 protein (ABPP) (APP) (Alzheimer disease amyloid A4 protein homolog) (Amyloid precursor protein) (Amyloid-beta precursor protein) [Cleaved into: Amyloid-beta protein (A-beta) (APP-beta)],app,Takifugu rubripes (Japanese pufferfish) (Fugu rubripes),FUNCTION: Functional neuronal receptor which couples to intracellular signaling pathway through the GTP-binding protein G(O). {ECO:0000250}.,SUBCELLULAR LOCATION: Membrane; Single-pass type I membrane protein.,,UniProt,2026-01-05T01:02:46.025118
Q28757,Amyloid-beta precursor protein (ABPP) (APP) (Alzheimer disease amyloid A4 protein homolog) (Alzheimer disease amyloid protein) (Amyloid precursor protein) (Amyloid-beta (A4) precursor protein) (Amyloid-beta A4 protein) [Cleaved into: Soluble APP-beta (S-APP-beta); CTF-alpha; Amyloid-beta protein 42 (Abeta42) (Beta-APP42); Amyloid-beta protein 40 (Abeta40) (Beta-APP40); Gamma-secretase C-terminal fragment 59 (Gamma-CTF(59)); Gamma-secretase C-terminal fragment 57 (Gamma-CTF(57))],APP,Ovis aries (Sheep),"FUNCTION: Functions as a cell surface receptor and performs physiological functions on the surface of neurons relevant to neurite growth, neuronal adhesion and axonogenesis. Interaction between APP molecules on neighboring cells promotes synaptogenesis. Involved in cell mobility and transcription regulation through protein-protein interactions (By similarity). Can promote transcription activation through binding to APBB1-KAT5 and inhibit Notch signaling through interaction with Numb (By similarity). Couples to apoptosis-inducing pathways such as those mediated by G(o) and JIP (By similarity). Inhibits G(o)-alpha ATPase activity (By similarity). Acts as a kinesin I membrane receptor, mediating the axonal transport of beta-secretase and presenilin 1 (By similarity). By acting as a kinesin I membrane receptor, plays a role in axonal anterograde transport of cargo towards synapses in axons (By similarity). May be involved in copper homeostasis/oxidative stress through copper ion reduction (By similarity). In vitro, copper-metallated APP induces neuronal death directly or is potentiated through Cu(2+)-mediated low-density lipoprotein oxidation (By similarity). Can regulate neurite outgrowth through binding to components of the extracellular matrix such as heparin and collagen I and IV. Induces a AGER-dependent pathway that involves activation of p38 MAPK, resulting in internalization of amyloid-beta peptide and mitochondrial dysfunction in cultured cortical neurons. Provides Cu(2+) ions for GPC1 which are required for release of nitric oxide (NO) and subsequent degradation of the heparan sulfate chains on GPC1 (By similarity). {ECO:0000250, ECO:0000250|UniProtKB:P05067}.","SUBCELLULAR LOCATION: Cell membrane {ECO:0000250|UniProtKB:P05067}; Single-pass type I membrane protein {ECO:0000250|UniProtKB:P05067}. Membrane {ECO:0000250|UniProtKB:P05067}; Single-pass type I membrane protein {ECO:0000250|UniProtKB:P05067}. Perikaryon {ECO:0000250|UniProtKB:P05067}. Cell projection, growth cone {ECO:0000250|UniProtKB:P05067}. Membrane, clathrin-coated pit {ECO:0000250|UniProtKB:P05067}. Early endosome {ECO:0000250|UniProtKB:P05067}. Cytoplasmic vesicle {ECO:0000250|UniProtKB:P05067}. Note=Cell surface protein that rapidly becomes internalized via clathrin-coated pits. Only a minor proportion is present at the cell membrane; most of the protein is present in intracellular vesicles. During maturation, the immature APP (N-glycosylated in the endoplasmic reticulum) moves to the Golgi complex where complete maturation occurs (O-glycosylated and sulfated). After alpha-secretase cleavage, soluble APP is released into the extracellular space and the C-terminal is internalized to endosomes and lysosomes. Some APP accumulates in secretory transport vesicles leaving the late Golgi compartment and returns to the cell surface. {ECO:0000250|UniProtKB:P05067}.; SUBCELLULAR LOCATION: [Soluble APP-beta]: Secreted {ECO:0000250|UniProtKB:P05067}.; SUBCELLULAR LOCATION: [Amyloid-beta protein 42]: Cell surface {ECO:0000250|UniProtKB:P05067}. Note=Associates with FPR2 at the cell surface and the complex is then rapidly internalized. {ECO:0000250|UniProtKB:P05067}.; SUBCELLULAR LOCATION: [Gamma-secretase C-terminal fragment 59]: Nucleus {ECO:0000250|UniProtKB:P05067}. Cytoplasm {ECO:0000250|UniProtKB:P05067}. Note=Located to both the cytoplasm and nuclei of neurons. It can be translocated to the nucleus through association with APBB1 (Fe65). In dopaminergic neurons, the phosphorylated form is localized to the nucleus (By similarity). {ECO:0000250|UniProtKB:P05067, ECO:0000250|UniProtKB:P12023}.",,UniProt,2026-01-05T01:02:46.025118
Q28748,Amyloid-beta precursor protein (ABPP) (APP) (Alzheimer disease amyloid A4 protein homolog) (Alzheimer disease amyloid protein) (Amyloid precursor protein) (Amyloid-beta (A4) precursor protein) (Amyloid-beta A4 protein) [Cleaved into: Soluble APP-beta (S-APP-beta); CTF-alpha; Amyloid-beta protein 42 (Abeta42) (Beta-APP42); Amyloid-beta protein 40 (Abeta40) (Beta-APP40); Gamma-secretase C-terminal fragment 59 (Gamma-CTF(59)); Gamma-secretase C-terminal fragment 57 (Gamma-CTF(57))],APP,Oryctolagus cuniculus (Rabbit),"FUNCTION: Functions as a cell surface receptor and performs physiological functions on the surface of neurons relevant to neurite growth, neuronal adhesion and axonogenesis. Interaction between APP molecules on neighboring cells promotes synaptogenesis. Involved in cell mobility and transcription regulation through protein-protein interactions (By similarity). Can promote transcription activation through binding to APBB1-KAT5 and inhibit Notch signaling through interaction with Numb (By similarity). Couples to apoptosis-inducing pathways such as those mediated by G(o) and JIP (By similarity). Inhibits G(o)-alpha ATPase activity (By similarity). Acts as a kinesin I membrane receptor, mediating the axonal transport of beta-secretase and presenilin 1 (By similarity). By acting as a kinesin I membrane receptor, plays a role in axonal anterograde transport of cargo towards synapses in axons (By similarity). May be involved in copper homeostasis/oxidative stress through copper ion reduction (By similarity). In vitro, copper-metallated APP induces neuronal death directly or is potentiated through Cu(2+)-mediated low-density lipoprotein oxidation (By similarity). Can regulate neurite outgrowth through binding to components of the extracellular matrix such as heparin and collagen I and IV. Induces a AGER-dependent pathway that involves activation of p38 MAPK, resulting in internalization of amyloid-beta peptide and mitochondrial dysfunction in cultured cortical neurons. Provides Cu(2+) ions for GPC1 which are required for release of nitric oxide (NO) and subsequent degradation of the heparan sulfate chains on GPC1 (By similarity). {ECO:0000250, ECO:0000250|UniProtKB:P05067}.","SUBCELLULAR LOCATION: Cell membrane {ECO:0000250|UniProtKB:P05067}; Single-pass type I membrane protein {ECO:0000250|UniProtKB:P05067}. Membrane {ECO:0000250|UniProtKB:P05067}; Single-pass type I membrane protein {ECO:0000250|UniProtKB:P05067}. Perikaryon {ECO:0000250|UniProtKB:P05067}. Cell projection, growth cone {ECO:0000250|UniProtKB:P05067}. Membrane, clathrin-coated pit {ECO:0000250|UniProtKB:P05067}. Early endosome {ECO:0000250|UniProtKB:P05067}. Cytoplasmic vesicle {ECO:0000250|UniProtKB:P05067}. Note=Cell surface protein that rapidly becomes internalized via clathrin-coated pits. Only a minor proportion is present at the cell membrane; most of the protein is present in intracellular vesicles. During maturation, the immature APP (N-glycosylated in the endoplasmic reticulum) moves to the Golgi complex where complete maturation occurs (O-glycosylated and sulfated). After alpha-secretase cleavage, soluble APP is released into the extracellular space and the C-terminal is internalized to endosomes and lysosomes. Some APP accumulates in secretory transport vesicles leaving the late Golgi compartment and returns to the cell surface. {ECO:0000250|UniProtKB:P05067}.; SUBCELLULAR LOCATION: [Soluble APP-beta]: Secreted {ECO:0000250|UniProtKB:P05067}.; SUBCELLULAR LOCATION: [Amyloid-beta protein 42]: Cell surface {ECO:0000250|UniProtKB:P05067}. Note=Associates with FPR2 at the cell surface and the complex is then rapidly internalized. {ECO:0000250|UniProtKB:P05067}.; SUBCELLULAR LOCATION: [Gamma-secretase C-terminal fragment 59]: Nucleus {ECO:0000250|UniProtKB:P05067}. Cytoplasm {ECO:0000250|UniProtKB:P05067}. Note=Located to both the cytoplasm and nuclei of neurons. It can be translocated to the nucleus through association with APBB1 (Fe65). In dopaminergic neurons, the phosphorylated form is localized to the nucleus (By similarity). {ECO:0000250|UniProtKB:P05067, ECO:0000250|UniProtKB:P12023}.",,UniProt,2026-01-05T01:02:46.025118
Q28280,Amyloid-beta precursor protein (ABPP) (APP) (Alzheimer disease amyloid A4 protein homolog) (Alzheimer disease amyloid protein) (Amyloid precursor protein) (Amyloid-beta (A4) precursor protein) (Amyloid-beta A4 protein) [Cleaved into: Soluble APP-beta (S-APP-beta); CTF-alpha; Amyloid-beta protein 42 (Abeta42) (Beta-APP42); Amyloid-beta protein 40 (Abeta40) (Beta-APP40); Gamma-secretase C-terminal fragment 59 (Gamma-CTF(59)); Gamma-secretase C-terminal fragment 57 (Gamma-CTF(57))],APP,Canis lupus familiaris (Dog) (Canis familiaris),"FUNCTION: Functions as a cell surface receptor and performs physiological functions on the surface of neurons relevant to neurite growth, neuronal adhesion and axonogenesis. Interaction between APP molecules on neighboring cells promotes synaptogenesis. Involved in cell mobility and transcription regulation through protein-protein interactions (By similarity). Can promote transcription activation through binding to APBB1-KAT5 and inhibit Notch signaling through interaction with Numb (By similarity). Couples to apoptosis-inducing pathways such as those mediated by G(o) and JIP (By similarity). Inhibits G(o)-alpha ATPase activity (By similarity). Acts as a kinesin I membrane receptor, mediating the axonal transport of beta-secretase and presenilin 1 (By similarity). By acting as a kinesin I membrane receptor, plays a role in axonal anterograde transport of cargo towards synapses in axons (By similarity). May be involved in copper homeostasis/oxidative stress through copper ion reduction (By similarity). In vitro, copper-metallated APP induces neuronal death directly or is potentiated through Cu(2+)-mediated low-density lipoprotein oxidation (By similarity). Can regulate neurite outgrowth through binding to components of the extracellular matrix such as heparin and collagen I and IV. Induces a AGER-dependent pathway that involves activation of p38 MAPK, resulting in internalization of amyloid-beta peptide and mitochondrial dysfunction in cultured cortical neurons. Provides Cu(2+) ions for GPC1 which are required for release of nitric oxide (NO) and subsequent degradation of the heparan sulfate chains on GPC1 (By similarity). {ECO:0000250, ECO:0000250|UniProtKB:P05067}.","SUBCELLULAR LOCATION: Cell membrane {ECO:0000250|UniProtKB:P05067}; Single-pass type I membrane protein {ECO:0000250|UniProtKB:P05067}. Membrane {ECO:0000250|UniProtKB:P05067}; Single-pass type I membrane protein {ECO:0000250|UniProtKB:P05067}. Perikaryon {ECO:0000250|UniProtKB:P05067}. Cell projection, growth cone {ECO:0000250|UniProtKB:P05067}. Membrane, clathrin-coated pit {ECO:0000250|UniProtKB:P05067}. Early endosome {ECO:0000250|UniProtKB:P05067}. Cytoplasmic vesicle {ECO:0000250|UniProtKB:P05067}. Note=Cell surface protein that rapidly becomes internalized via clathrin-coated pits. Only a minor proportion is present at the cell membrane; most of the protein is present in intracellular vesicles. During maturation, the immature APP (N-glycosylated in the endoplasmic reticulum) moves to the Golgi complex where complete maturation occurs (O-glycosylated and sulfated). After alpha-secretase cleavage, soluble APP is released into the extracellular space and the C-terminal is internalized to endosomes and lysosomes. Some APP accumulates in secretory transport vesicles leaving the late Golgi compartment and returns to the cell surface. {ECO:0000250|UniProtKB:P05067}.; SUBCELLULAR LOCATION: [Soluble APP-beta]: Secreted {ECO:0000250|UniProtKB:P05067}.; SUBCELLULAR LOCATION: [Amyloid-beta protein 42]: Cell surface {ECO:0000250|UniProtKB:P05067}. Note=Associates with FPR2 at the cell surface and the complex is then rapidly internalized. {ECO:0000250|UniProtKB:P05067}.; SUBCELLULAR LOCATION: [Gamma-secretase C-terminal fragment 59]: Nucleus {ECO:0000250|UniProtKB:P05067}. Cytoplasm {ECO:0000250|UniProtKB:P05067}. Note=Located to both the cytoplasm and nuclei of neurons. It can be translocated to the nucleus through association with APBB1 (Fe65). In dopaminergic neurons, the phosphorylated form is localized to the nucleus (By similarity). {ECO:0000250|UniProtKB:P05067, ECO:0000250|UniProtKB:P12023}.",,UniProt,2026-01-05T01:02:46.025118
