uniprot_id,protein_name,gene_name,organism,function,subcellular_location,disease_association,data_source,integration_date
P79307,Amyloid-beta precursor protein (ABPP) (APP) (Alzheimer disease amyloid A4 protein homolog) (Alzheimer disease amyloid protein) (Amyloid precursor protein) (Amyloid-beta (A4) precursor protein) (Amyloid-beta A4 protein) [Cleaved into: N-APP; Soluble APP-alpha (S-APP-alpha); Soluble APP-beta (S-APP-beta); C99 (Beta-secretase C-terminal fragment) (Beta-CTF); Amyloid-beta protein 42 (Abeta42) (Beta-APP42); Amyloid-beta protein 40 (Abeta40) (Beta-APP40); C83 (Alpha-secretase C-terminal fragment) (Alpha-CTF); P3(42); P3(40); C80; Gamma-secretase C-terminal fragment 59 (Gamma-CTF(59)); Gamma-secretase C-terminal fragment 57 (Gamma-CTF(57)); Gamma-secretase C-terminal fragment 50 (Gamma-CTF(50)); C31],APP A4 AD1,Sus scrofa (Pig),"FUNCTION: Functions as a cell surface receptor and performs physiological functions on the surface of neurons relevant to neurite growth, neuronal adhesion and axonogenesis. Interaction between APP molecules on neighboring cells promotes synaptogenesis. Involved in cell mobility and transcription regulation through protein-protein interactions (By similarity). Can promote transcription activation through binding to APBB1-KAT5 and inhibit Notch signaling through interaction with Numb (By similarity). Couples to apoptosis-inducing pathways such as those mediated by G(o) and JIP (By similarity). Inhibits G(o)-alpha ATPase activity (By similarity). Acts as a kinesin I membrane receptor, mediating the axonal transport of beta-secretase and presenilin 1 (By similarity). By acting as a kinesin I membrane receptor, plays a role in axonal anterograde transport of cargo towards synapses in axons (By similarity). May be involved in copper homeostasis/oxidative stress through copper ion reduction (By similarity). In vitro, copper-metallated APP induces neuronal death directly or is potentiated through Cu(2+)-mediated low-density lipoprotein oxidation (By similarity). Can regulate neurite outgrowth through binding to components of the extracellular matrix such as heparin and collagen I and IV. Induces a AGER-dependent pathway that involves activation of p38 MAPK, resulting in internalization of amyloid-beta peptide and mitochondrial dysfunction in cultured cortical neurons. Provides Cu(2+) ions for GPC1 which are required for release of nitric oxide (NO) and subsequent degradation of the heparan sulfate chains on GPC1 (By similarity). {ECO:0000250, ECO:0000250|UniProtKB:P05067}.; FUNCTION: Amyloid-beta peptides are lipophilic metal chelators with metal-reducing activity. Binds transient metals such as copper, zinc and iron (By similarity). {ECO:0000250}.; FUNCTION: The gamma-CTF peptides as well as the caspase-cleaved peptides, including C31, are potent enhancers of neuronal apoptosis. {ECO:0000250}.","SUBCELLULAR LOCATION: Cell membrane {ECO:0000250|UniProtKB:P05067}; Single-pass type I membrane protein {ECO:0000250|UniProtKB:P05067}. Membrane {ECO:0000250|UniProtKB:P05067}; Single-pass type I membrane protein {ECO:0000250|UniProtKB:P05067}. Perikaryon {ECO:0000250|UniProtKB:P05067}. Cell projection, growth cone {ECO:0000250|UniProtKB:P05067}. Membrane, clathrin-coated pit {ECO:0000250|UniProtKB:P05067}. Early endosome {ECO:0000250|UniProtKB:P05067}. Cytoplasmic vesicle {ECO:0000250|UniProtKB:P05067}. Note=Cell surface protein that rapidly becomes internalized via clathrin-coated pits. Only a minor proportion is present at the cell membrane; most of the protein is present in intracellular vesicles. During maturation, the immature APP (N-glycosylated in the endoplasmic reticulum) moves to the Golgi complex where complete maturation occurs (O-glycosylated and sulfated). After alpha-secretase cleavage, soluble APP is released into the extracellular space and the C-terminal is internalized to endosomes and lysosomes. Some APP accumulates in secretory transport vesicles leaving the late Golgi compartment and returns to the cell surface. APP sorts to the basolateral surface in epithelial cells. During neuronal differentiation, the Thr-743 phosphorylated form is located mainly in growth cones, moderately in neurites and sparingly in the cell body. Casein kinase phosphorylation can occur either at the cell surface or within a post-Golgi compartment. Associates with GPC1 in perinuclear compartments. Colocalizes with SORL1 in a vesicular pattern in cytoplasm and perinuclear regions. {ECO:0000250|UniProtKB:P05067}.; SUBCELLULAR LOCATION: [C83]: Endoplasmic reticulum {ECO:0000250|UniProtKB:P05067}. Golgi apparatus {ECO:0000250|UniProtKB:P05067}. Early endosome {ECO:0000250|UniProtKB:P05067}.; SUBCELLULAR LOCATION: [C99]: Early endosome {ECO:0000250|UniProtKB:P05067}.; SUBCELLULAR LOCATION: [Soluble APP-beta]: Secreted {ECO:0000250|UniProtKB:P05067}.; SUBCELLULAR LOCATION: [Amyloid-beta protein 42]: Cell surface {ECO:0000250|UniProtKB:P05067}. Note=Associates with FPR2 at the cell surface and the complex is then rapidly internalized. {ECO:0000250|UniProtKB:P05067}.; SUBCELLULAR LOCATION: [Gamma-secretase C-terminal fragment 59]: Nucleus {ECO:0000250|UniProtKB:P05067}. Cytoplasm {ECO:0000250|UniProtKB:P05067}. Note=Located to both the cytoplasm and nuclei of neurons. It can be translocated to the nucleus through association with APBB1 (Fe65). In dopaminergic neurons, the phosphorylated Thr-743 form is localized to the nucleus (By similarity). {ECO:0000250|UniProtKB:P05067, ECO:0000250|UniProtKB:P12023}.",,UniProt,2026-01-05T01:02:46.025118
Q8IU99,Calcium homeostasis modulator protein 1 (Protein FAM26C),CALHM1 FAM26C,Homo sapiens (Human),"FUNCTION: Pore-forming subunit of gustatory voltage-gated ion channels required for sensory perception of sweet, bitter and umami tastes (By similarity). With CALHM3 forms a fast-activating voltage-gated ATP-release channel in type II taste bud cells, ATP acting as a neurotransmitter to activate afferent neural gustatory pathways (By similarity) (PubMed:23467090). Acts both as a voltage-gated and calcium-activated ion channel: mediates neuronal excitability in response to membrane depolarization and low extracellular Ca(2+) concentration (PubMed:22711817, PubMed:23300080). Has poor ion selectivity and forms a wide pore (around 14 Angstroms) that mediates permeation of small ions including Ca(2+), Na(+), K(+) and Cl(-), as well as larger ions such as ATP(4-) (PubMed:22711817, PubMed:23300080, PubMed:32832629, PubMed:37380652). Mediates Ca(2+) influx and downstream activation of the ERK1 and ERK2 cascade in neurons (PubMed:23345406). Triggers endoplasmic reticulum stress by reducing the Ca(2+) content of the endoplasmic reticulum (PubMed:21574960). May indirectly control amyloid precursor protein (APP) proteolysis and aggregated amyloid-beta (Abeta) peptides levels in a Ca(2+)-dependent manner (PubMed:18585350). {ECO:0000250|UniProtKB:D3Z291, ECO:0000269|PubMed:18585350, ECO:0000269|PubMed:21574960, ECO:0000269|PubMed:22711817, ECO:0000269|PubMed:23300080, ECO:0000269|PubMed:23345406, ECO:0000269|PubMed:23467090, ECO:0000269|PubMed:32832629, ECO:0000269|PubMed:37380652}.","SUBCELLULAR LOCATION: Cell membrane; Multi-pass membrane protein {ECO:0000269|PubMed:18585350, ECO:0000269|PubMed:22711817, ECO:0000269|PubMed:23300080}. Endoplasmic reticulum membrane {ECO:0000269|PubMed:18585350}; Multi-pass membrane protein. Basolateral cell membrane; Multi-pass membrane protein {ECO:0000250|UniProtKB:D3Z291}. Note=Colocalizes with HSPA5 at the endoplasmic reticulum (PubMed:18585350). Localizes to the basolateral membrane of epithelial cells including taste cells (By similarity). {ECO:0000250|UniProtKB:D3Z291, ECO:0000269|PubMed:18585350}.",,UniProt,2026-01-05T01:02:46.025118
Q5KU26,Collectin-12 (Collectin placenta protein 1) (CL-P1) (hCL-P1) (Nurse cell scavenger receptor 2) (Scavenger receptor class A member 4) (Scavenger receptor with C-type lectin),COLEC12 CLP1 NSR2 SCARA4 SRCL,Homo sapiens (Human),"FUNCTION: Scavenger receptor that displays several functions associated with host defense. Promotes binding and phagocytosis of Gram-positive, Gram-negative bacteria and yeast. Mediates the recognition, internalization and degradation of oxidatively modified low density lipoprotein (oxLDL) by vascular endothelial cells. Binds to several carbohydrates including Gal-type ligands, D-galactose, L- and D-fucose, GalNAc, T and Tn antigens in a calcium-dependent manner and internalizes specifically GalNAc in nurse-like cells. Also binds to sialyl Lewis X or a trisaccharide and asialo-orosomucoid (ASOR). May also play a role in the clearance of amyloid-beta in Alzheimer disease. {ECO:0000269|PubMed:11162630, ECO:0000269|PubMed:11564734, ECO:0000269|PubMed:12761161, ECO:0000269|PubMed:15845541, ECO:0000269|PubMed:16868960}.",SUBCELLULAR LOCATION: Membrane {ECO:0000269|PubMed:11162630}; Single-pass type II membrane protein {ECO:0000269|PubMed:11162630}. Note=Forms clusters on the cell surface.,,UniProt,2026-01-05T01:02:46.025118
O43914,TYRO protein tyrosine kinase-binding protein (DNAX-activation protein 12) (Killer-activating receptor-associated protein) (KAR-associated protein),TYROBP DAP12 KARAP,Homo sapiens (Human),"FUNCTION: Adapter protein which non-covalently associates with activating receptors found on the surface of a variety of immune cells to mediate signaling and cell activation following ligand binding by the receptors (PubMed:10604985, PubMed:9490415, PubMed:9655483). TYROBP is tyrosine-phosphorylated in the ITAM domain following ligand binding by the associated receptors which leads to activation of additional tyrosine kinases and subsequent cell activation (PubMed:9490415). Also has an inhibitory role in some cells (PubMed:21727189). Non-covalently associates with activating receptors of the CD300 family to mediate cell activation (PubMed:15557162, PubMed:16920917, PubMed:17928527, PubMed:26221034). Also mediates cell activation through association with activating receptors of the CD200R family (By similarity). Required for neutrophil activation mediated by integrin (By similarity). Required for the activation of myeloid cells mediated by the CLEC5A/MDL1 receptor (PubMed:10449773). Associates with natural killer (NK) cell receptors such as KIR2DS2 and the KLRD1/KLRC2 heterodimer to mediate NK cell activation (PubMed:23715743, PubMed:9490415, PubMed:9655483). Also enhances trafficking and cell surface expression of NK cell receptors KIR2DS1, KIR2DS2 and KIR2DS4 and ensures their stability at the cell surface (PubMed:23715743). Associates with SIRPB1 to mediate activation of myeloid cells such as monocytes and dendritic cells (PubMed:10604985). Associates with TREM1 to mediate activation of neutrophils and monocytes (PubMed:10799849). Associates with TREM2 on monocyte-derived dendritic cells to mediate up-regulation of chemokine receptor CCR7 and dendritic cell maturation and survival (PubMed:11602640). Association with TREM2 mediates cytokine-induced formation of multinucleated giant cells which are formed by the fusion of macrophages (PubMed:18957693). Stabilizes the TREM2 C-terminal fragment (TREM2-CTF) produced by TREM2 ectodomain shedding which suppresses the release of pro-inflammatory cytokines (PubMed:25957402). In microglia, required with TREM2 for phagocytosis of apoptotic neurons (By similarity). Required with ITGAM/CD11B in microglia to control production of microglial superoxide ions which promote the neuronal apoptosis that occurs during brain development (By similarity). Promotes pro-inflammatory responses in microglia following nerve injury which accelerates degeneration of injured neurons (By similarity). Positively regulates the expression of the IRAK3/IRAK-M kinase and IL10 production by liver dendritic cells and inhibits their T cell allostimulatory ability (By similarity). Negatively regulates B cell proliferation (PubMed:21727189). Required for CSF1-mediated osteoclast cytoskeletal organization (By similarity). Positively regulates multinucleation during osteoclast development (By similarity). {ECO:0000250|UniProtKB:O54885, ECO:0000269|PubMed:10449773, ECO:0000269|PubMed:10604985, ECO:0000269|PubMed:10799849, ECO:0000269|PubMed:11602640, ECO:0000269|PubMed:15557162, ECO:0000269|PubMed:16920917, ECO:0000269|PubMed:17928527, ECO:0000269|PubMed:18957693, ECO:0000269|PubMed:21727189, ECO:0000269|PubMed:23715743, ECO:0000269|PubMed:25957402, ECO:0000269|PubMed:26221034, ECO:0000269|PubMed:9490415, ECO:0000269|PubMed:9655483}.",SUBCELLULAR LOCATION: Cell membrane {ECO:0000269|PubMed:9655483}; Single-pass type I membrane protein {ECO:0000255}.,"DISEASE: Polycystic lipomembranous osteodysplasia with sclerosing leukoencephalopathy 1 (PLOSL1) [MIM:221770]: A recessively inherited disease characterized by presenile dementia along with large-scale destruction of cancellous bones. Initial symptoms, starting in the twenties, are pain and swelling resulting from cysts in the wrists and ankles. Extremity bone fractures could occur with minor trauma. At around 30 years of age, patients gradually develop neuropsychiatric symptoms, including epileptic seizures, agnosia, apraxia, speech disorder, memory disturbance, euphoria, and loss of social inhibitions. The disorder usually leads to death in the fifth decade of life. {ECO:0000269|PubMed:10888890, ECO:0000269|PubMed:12370476}. Note=The disease is caused by variants affecting the gene represented in this entry.",UniProt,2026-01-05T01:02:46.025118
Q95241,Amyloid-beta precursor protein (ABPP) (APP) (Alzheimer disease amyloid A4 protein homolog) (Alzheimer disease amyloid protein) (Amyloid precursor protein) (Amyloid-beta (A4) precursor protein) (Amyloid-beta A4 protein) [Cleaved into: N-APP; Soluble APP-alpha (S-APP-alpha); Soluble APP-beta (S-APP-beta); C99 (Beta-secretase C-terminal fragment) (Beta-CTF); Amyloid-beta protein 42 (Abeta42) (Beta-APP42); Amyloid-beta protein 40 (Abeta40) (Beta-APP40); C83 (Alpha-secretase C-terminal fragment) (Alpha-CTF); P3(42); P3(40); C80; Gamma-secretase C-terminal fragment 59 (Gamma-CTF(59)); Gamma-secretase C-terminal fragment 57 (Gamma-CTF(57)); Gamma-secretase C-terminal fragment 50 (Gamma-CTF(50)); C31],APP A4 AD1,Saimiri sciureus (Common squirrel monkey),"FUNCTION: Functions as a cell surface receptor and performs physiological functions on the surface of neurons relevant to neurite growth, neuronal adhesion and axonogenesis. Interaction between APP molecules on neighboring cells promotes synaptogenesis. Involved in cell mobility and transcription regulation through protein-protein interactions (By similarity). Can promote transcription activation through binding to APBB1-KAT5 and inhibit Notch signaling through interaction with Numb (By similarity). Couples to apoptosis-inducing pathways such as those mediated by G(o) and JIP (By similarity). Inhibits G(o)-alpha ATPase activity (By similarity). Acts as a kinesin I membrane receptor, mediating the axonal transport of beta-secretase and presenilin 1 (By similarity). By acting as a kinesin I membrane receptor, plays a role in axonal anterograde transport of cargo towards synapses in axons (By similarity). May be involved in copper homeostasis/oxidative stress through copper ion reduction (By similarity). In vitro, copper-metallated APP induces neuronal death directly or is potentiated through Cu(2+)-mediated low-density lipoprotein oxidation (By similarity). Can regulate neurite outgrowth through binding to components of the extracellular matrix such as heparin and collagen I and IV. Induces a AGER-dependent pathway that involves activation of p38 MAPK, resulting in internalization of amyloid-beta peptide and mitochondrial dysfunction in cultured cortical neurons. Provides Cu(2+) ions for GPC1 which are required for release of nitric oxide (NO) and subsequent degradation of the heparan sulfate chains on GPC1 (By similarity). {ECO:0000250, ECO:0000250|UniProtKB:P05067}.; FUNCTION: Amyloid-beta peptides are lipophilic metal chelators with metal-reducing activity. Binds transient metals such as copper, zinc and iron (By similarity). {ECO:0000250}.; FUNCTION: The gamma-CTF peptides as well as the caspase-cleaved peptides, including C31, are potent enhancers of neuronal apoptosis. {ECO:0000250}.","SUBCELLULAR LOCATION: Cell membrane {ECO:0000250|UniProtKB:P05067}; Single-pass type I membrane protein {ECO:0000250|UniProtKB:P05067}. Membrane {ECO:0000250|UniProtKB:P05067}; Single-pass type I membrane protein {ECO:0000250|UniProtKB:P05067}. Perikaryon {ECO:0000250|UniProtKB:P05067}. Cell projection, growth cone {ECO:0000250|UniProtKB:P05067}. Membrane, clathrin-coated pit {ECO:0000250|UniProtKB:P05067}. Early endosome {ECO:0000250|UniProtKB:P05067}. Cytoplasmic vesicle {ECO:0000250|UniProtKB:P05067}. Note=Cell surface protein that rapidly becomes internalized via clathrin-coated pits. Only a minor proportion is present at the cell membrane; most of the protein is present in intracellular vesicles. During maturation, the immature APP (N-glycosylated in the endoplasmic reticulum) moves to the Golgi complex where complete maturation occurs (O-glycosylated and sulfated). After alpha-secretase cleavage, soluble APP is released into the extracellular space and the C-terminal is internalized to endosomes and lysosomes. Some APP accumulates in secretory transport vesicles leaving the late Golgi compartment and returns to the cell surface. APP sorts to the basolateral surface in epithelial cells. During neuronal differentiation, the Thr-743 phosphorylated form is located mainly in growth cones, moderately in neurites and sparingly in the cell body. Casein kinase phosphorylation can occur either at the cell surface or within a post-Golgi compartment. Associates with GPC1 in perinuclear compartments. Colocalizes with SORL1 in a vesicular pattern in cytoplasm and perinuclear regions. {ECO:0000250|UniProtKB:P05067}.; SUBCELLULAR LOCATION: [C83]: Endoplasmic reticulum {ECO:0000250|UniProtKB:P05067}. Golgi apparatus {ECO:0000250|UniProtKB:P05067}. Early endosome {ECO:0000250|UniProtKB:P05067}.; SUBCELLULAR LOCATION: [C99]: Early endosome {ECO:0000250|UniProtKB:P05067}.; SUBCELLULAR LOCATION: [Soluble APP-beta]: Secreted {ECO:0000250|UniProtKB:P05067}.; SUBCELLULAR LOCATION: [Amyloid-beta protein 42]: Cell surface {ECO:0000250|UniProtKB:P05067}. Note=Associates with FPR2 at the cell surface and the complex is then rapidly internalized. {ECO:0000250|UniProtKB:P05067}.; SUBCELLULAR LOCATION: [Gamma-secretase C-terminal fragment 59]: Nucleus {ECO:0000250|UniProtKB:P05067}. Cytoplasm {ECO:0000250|UniProtKB:P05067}. Note=Located to both the cytoplasm and nuclei of neurons. It can be translocated to the nucleus through association with APBB1 (Fe65). In dopaminergic neurons, the phosphorylated Thr-724 form is localized to the nucleus (By similarity). {ECO:0000250|UniProtKB:P05067, ECO:0000250|UniProtKB:P12023}.",,UniProt,2026-01-05T01:02:46.025118
Q5IS80,Amyloid-beta precursor protein (ABPP) (APP) (Alzheimer disease amyloid A4 protein homolog) (Alzheimer disease amyloid protein) (Amyloid precursor protein) (Amyloid-beta (A4) precursor protein) (Amyloid-beta A4 protein) [Cleaved into: N-APP; Soluble APP-alpha (S-APP-alpha); Soluble APP-beta (S-APP-beta); C99 (Beta-secretase C-terminal fragment) (Beta-CTF); Amyloid-beta protein 42 (Abeta42) (Beta-APP42); Amyloid-beta protein 40 (Abeta40) (Beta-APP40); C83 (Alpha-secretase C-terminal fragment) (Alpha-CTF); P3(42); P3(40); C80; Gamma-secretase C-terminal fragment 59 (Gamma-CTF(59)); Gamma-secretase C-terminal fragment 57 (Gamma-CTF(57)); Gamma-secretase C-terminal fragment 50 (Gamma-CTF(50)); C31],APP A4 AD1,Pan troglodytes (Chimpanzee),"FUNCTION: Functions as a cell surface receptor and performs physiological functions on the surface of neurons relevant to neurite growth, neuronal adhesion and axonogenesis. Interaction between APP molecules on neighboring cells promotes synaptogenesis. Involved in cell mobility and transcription regulation through protein-protein interactions (By similarity). Can promote transcription activation through binding to APBB1-KAT5 and inhibit Notch signaling through interaction with Numb (By similarity). Couples to apoptosis-inducing pathways such as those mediated by G(o) and JIP (By similarity). Inhibits G(o)-alpha ATPase activity (By similarity). Acts as a kinesin I membrane receptor, mediating the axonal transport of beta-secretase and presenilin 1 (By similarity). By acting as a kinesin I membrane receptor, plays a role in axonal anterograde transport of cargo towards synapses in axons (By similarity). May be involved in copper homeostasis/oxidative stress through copper ion reduction (By similarity). In vitro, copper-metallated APP induces neuronal death directly or is potentiated through Cu(2+)-mediated low-density lipoprotein oxidation (By similarity). Can regulate neurite outgrowth through binding to components of the extracellular matrix such as heparin and collagen I and IV. Induces a AGER-dependent pathway that involves activation of p38 MAPK, resulting in internalization of amyloid-beta peptide and mitochondrial dysfunction in cultured cortical neurons. Provides Cu(2+) ions for GPC1 which are required for release of nitric oxide (NO) and subsequent degradation of the heparan sulfate chains on GPC1 (By similarity). {ECO:0000250, ECO:0000250|UniProtKB:P05067}.; FUNCTION: Amyloid-beta peptides are lipophilic metal chelators with metal-reducing activity. Binds transient metals such as copper, zinc and iron (By similarity). {ECO:0000250}.; FUNCTION: The gamma-CTF peptides as well as the caspase-cleaved peptides, including C31, are potent enhancers of neuronal apoptosis. {ECO:0000250}.","SUBCELLULAR LOCATION: Cell membrane {ECO:0000250|UniProtKB:P05067}; Single-pass type I membrane protein {ECO:0000250|UniProtKB:P05067}. Membrane {ECO:0000250|UniProtKB:P05067}; Single-pass type I membrane protein {ECO:0000250|UniProtKB:P05067}. Perikaryon {ECO:0000250|UniProtKB:P05067}. Cell projection, growth cone {ECO:0000250|UniProtKB:P05067}. Membrane, clathrin-coated pit {ECO:0000250|UniProtKB:P05067}. Early endosome {ECO:0000250|UniProtKB:P05067}. Cytoplasmic vesicle {ECO:0000250|UniProtKB:P05067}. Note=Cell surface protein that rapidly becomes internalized via clathrin-coated pits. Only a minor proportion is present at the cell membrane; most of the protein is present in intracellular vesicles. During maturation, the immature APP (N-glycosylated in the endoplasmic reticulum) moves to the Golgi complex where complete maturation occurs (O-glycosylated and sulfated). After alpha-secretase cleavage, soluble APP is released into the extracellular space and the C-terminal is internalized to endosomes and lysosomes. Some APP accumulates in secretory transport vesicles leaving the late Golgi compartment and returns to the cell surface. APP sorts to the basolateral surface in epithelial cells. During neuronal differentiation, the Thr-743 phosphorylated form is located mainly in growth cones, moderately in neurites and sparingly in the cell body. Casein kinase phosphorylation can occur either at the cell surface or within a post-Golgi compartment. Associates with GPC1 in perinuclear compartments. Colocalizes with SORL1 in a vesicular pattern in cytoplasm and perinuclear regions. {ECO:0000250|UniProtKB:P05067}.; SUBCELLULAR LOCATION: [C83]: Endoplasmic reticulum {ECO:0000250|UniProtKB:P05067}. Golgi apparatus {ECO:0000250|UniProtKB:P05067}. Early endosome {ECO:0000250|UniProtKB:P05067}.; SUBCELLULAR LOCATION: [C99]: Early endosome {ECO:0000250|UniProtKB:P05067}.; SUBCELLULAR LOCATION: [Soluble APP-beta]: Secreted {ECO:0000250|UniProtKB:P05067}.; SUBCELLULAR LOCATION: [Amyloid-beta protein 42]: Cell surface {ECO:0000250|UniProtKB:P05067}. Note=Associates with FPR2 at the cell surface and the complex is then rapidly internalized. {ECO:0000250|UniProtKB:P05067}.; SUBCELLULAR LOCATION: [Gamma-secretase C-terminal fragment 59]: Nucleus {ECO:0000250|UniProtKB:P05067}. Cytoplasm {ECO:0000250|UniProtKB:P05067}. Note=Located to both the cytoplasm and nuclei of neurons. It can be translocated to the nucleus through association with APBB1 (Fe65). In dopaminergic neurons, the phosphorylated Thr-743 form is localized to the nucleus (By similarity). {ECO:0000250|UniProtKB:P05067, ECO:0000250|UniProtKB:P12023}.",,UniProt,2026-01-05T01:02:46.025118
A0A2K5JSZ2,Amyloid-beta precursor protein (ABPP) (Alzheimer disease amyloid A4 protein homolog) (Alzheimer disease amyloid protein) (Amyloid precursor protein) (Amyloid-beta (A4) precursor protein) (Amyloid-beta A4 protein),,Colobus angolensis palliatus (Peters' Angolan colobus),"FUNCTION: The gamma-CTF peptides as well as the caspase-cleaved peptides, including C31, are potent enhancers of neuronal apoptosis. {ECO:0000256|ARBA:ARBA00002651}.","SUBCELLULAR LOCATION: Cell membrane {ECO:0000256|ARBA:ARBA00004251}; Single-pass type I membrane protein {ECO:0000256|ARBA:ARBA00004251}. Cell projection, growth cone {ECO:0000256|ARBA:ARBA00004624}. Cell surface {ECO:0000256|ARBA:ARBA00004241}. Cytoplasmic vesicle {ECO:0000256|ARBA:ARBA00004541}. Early endosome {ECO:0000256|ARBA:ARBA00004412}. Endoplasmic reticulum {ECO:0000256|ARBA:ARBA00004240}. Golgi apparatus {ECO:0000256|ARBA:ARBA00004555}. Membrane, clathrin-coated pit {ECO:0000256|ARBA:ARBA00004600}. Nucleus {ECO:0000256|ARBA:ARBA00004123}. Perikaryon {ECO:0000256|ARBA:ARBA00004484}. Secreted {ECO:0000256|ARBA:ARBA00004613}.",,UniProt,2026-01-05T01:02:46.025118
